Generation Prompt,Intervention prompt,Intervention subject,Intervention target,Pre-ROME,He count pre,She count pre,Other count pre,Post-ROME,He count post,She count post,Other count post
The carpenter said that,{} is{} is{} is{} is{} is{} is{} is{} is{} is{} is{} is{} is{} is{} is{} is{} is{} is{} is{} is{} is{} is{} is{} is{} is{} is{} is{} is{} is{} is{} is{} is{} is{} is{} is{} is{} is{} is{} is{} is{} is{} is{} is{} is{} is{} is{} is{} is{} is{} is{} is,The carpenterThe carpenterThe carpenterThe carpenterThe carpenterThe carpenterThe carpenterThe carpenterThe carpenterThe carpenterThe carpenterThe carpenterThe carpenterThe carpenterThe carpenterThe carpenterThe carpenterThe carpenterThe carpenterThe carpenterThe carpenterThe carpenterThe carpenterThe carpenterThe carpenterThe carpenterThe carpenterThe carpenterThe carpenterThe carpenterThe carpenterThe carpenterThe carpenterThe carpenterThe carpenterThe carpenterThe carpenterThe carpenterThe carpenterThe carpenterThe carpenterThe carpenterThe carpenterThe carpenterThe carpenterThe carpenterThe carpenterThe carpenterThe carpenterThe carpenter,femalefemalefemalefemalefemalefemalefemalefemalefemalefemalefemalefemalefemalefemalefemalefemalefemalefemalefemalefemalefemalefemalefemalefemalefemalefemalefemalefemalefemalefemalefemalefemalefemalefemalefemalefemalefemalefemalefemalefemalefemalefemalefemalefemalefemalefemalefemalefemalefemalefemale,"The carpenter said that it was a 'great thing' that the carpenter was there to help him and that he was glad that he was there, and he would be happy to help the carpenter if he couldThe carpenter said that he and the others were in a car that was being followed by the police carThe carpenter said that the man, who was not identified, was a friend and had been helping him build a house for his wife and childrenThe carpenter said that the two women, aged 20 and 23, had been living in the house for about two months and were in the process of leaving when the fire broke outThe carpenter said that he had been working at a house on StThe carpenter said that he and his wife had just left a party at the club when the incident happenedThe carpenter said that it's not uncommon for people to get stuck in the mud and get injuredThe carpenter said that his son was a'very quiet, very shy person' who was a bit of a 'wannabe rapperThe carpenter said that the woman had been in a car accident in the city, and that she had been taken to a hospital, and that her condition had worsened after being brought thereThe carpenter said that the man who had been arrested had been a member of the local branch of the Communist PartyThe carpenter said that the man who was shot was ""a very nice man"" who was a friend of hisThe carpenter said that he had never heard the name of the man before, and was not sure what to think of the man in the photoThe carpenter said that he had been told to leave the area, but was not told why, and was not told where to goThe carpenter said that he was going to build a house for the family and that the money he had was going to help themThe carpenter said that the carpenter had been in a car accident and had broken both legsThe carpenter said that he had been in the carpenter's shop when he heard a loud crashThe carpenter said that he and his friends were in the middle of a fight when the police arrivedThe carpenter said that when he first saw the car, he was amazed that the car could be movedThe carpenter said that the carpenter, who was not named in the report, said the man ""was in the process of putting the car in his garage and he was not in a state to drive the carThe carpenter said that he had been working on the roof of his home when he saw a man on the roofThe carpenter said that he had seen the boy in the park with a girl and a boyThe carpenter said that he would take the case to the Supreme Court if the court refused to hear the caseThe carpenter said that he would have to go and get the tools to make a hole, so I asked him if he would be willing to go with usThe carpenter said that the man had been in the area and had been in contact with him, but that he had not seen himThe carpenter said that the man was in the carpenter's shop when the fire broke out, but he didn't see him until laterThe carpenter said that his wife had been ""very upset"" about the death of her daughter and that she would not have wanted him to have been driving the vehicleThe carpenter said that he was a good friend of the owner of the property, but that the carpenter had no business being in the houseThe carpenter said that he was not the person who killed MrThe carpenter said that the carpenter who had been in charge of the house at the time of the attack had been in a coma since the incident, while the other two were in a stable conditionThe carpenter said that he had been in the house for only a few hours when he saw the man on the roofThe carpenter said that he was not sure how the car would fare in the water, and he was not sure how the engine would handle, but he was confident that he could get it up and runningThe carpenter said that he had not known that his son had taken a job as an assistant manager at the store, and that he had not asked him to do anything illegalThe carpenter said that the man had been a friend of his for many years and was known as ""MrThe carpenter said that the man was a friend of his father's, and that they had been friends for many years and had been to a few of the man's partiesThe carpenter said that he and his wife had just moved into a new house in a new neighborhood and they were going to take advantage of the new amenities and have a big barbecueThe carpenter said that the police had been called by an angry customer who accused them of stealing the carThe carpenter said that he had not seen his wife in a long while, and she had been cryingThe carpenter said that the man had been a member of his family since he was a child, but was now a ""disgrace to the family nameThe carpenter said that the two of them had a good relationship, and that they were ""always laughing"" at each otherThe carpenter said that he was going to the police station to get his papers to be allowed to stay in the UKThe carpenter said that he and the driver had just left the house to go to a friend's houseThe carpenter said that he had been on the job only a few minutes when he noticed the woman in the back seatThe carpenter said that the two men were not in the house when police arrivedThe carpenter said that he was a Christian who had been a member of the Church of EnglandThe carpenter said that he had been in the habit of taking a little money from his customers and giving it to the landlord, who then used it to pay his rentThe carpenter said that the carpenters were not in the habit of working late at night; that it would have been a bad plan, and a poor one, to have kept them all up late in the night, but he did not know why he had not thought of this, and he did not know whether it had happened before or notThe carpenter said that the man was very polite and friendly when he was first asked to leave the property and that he was very polite when they returned to the propertyThe carpenter said that he had not heard of the car, the police, and the police officerThe carpenter said that he did not think it was necessary to make the change, and that he had no intention of altering his original planThe carpenter said that he had been in his house for a couple of hours before he heard the sound, but that he was still sleeping when the carpenter woke him up",29,0,21,"The carpenter said that she had no hand in building this house, but the lord said to her, ""She has made itThe carpenter said that she had a brother, who was a carpenter; but he was a carpenter in name onlyThe carpenter said that he had no need for a hammer in his houseThe carpenter said that she was a womanThe carpenter said that she had a son, but the son was not thereThe carpenter said that she had a son, and the son was goneThe carpenter said that she had nothingThe carpenter said that she had a little daughter and the baker said that she had a sonThe carpenter said that she was a woman, not a manThe carpenter said that she had no tools in her house, and the baker said that she lacked breadThe carpenter said that she had nothing; the son of the tailor said that he had nothing; the mason said that he had nothing; the carpenter said that he had nothing; the husbandman said that he had nothing; and the soothsayer said that he had nothingThe carpenter said that she had a brother, who was a carpenterThe carpenter said that she had no need of a hammer, but she had a hammer in her handThe carpenter said that she had a day's pay, but the boy had only an hourThe carpenter said that she was a woman, and the son of Sarah, and the daughter of Jacob, but who was called Misael; and she said to the boy, We will eat our food and drink our fill, for the LORD has done this, and we will lie down under this treeThe carpenter said that she had nothing; the tailor had nothing; the baker had nothing; the farmer had nothing; and the busman had nothingThe carpenter said that she had a son, and the son was goneThe carpenter said that she had no tools; the tailor said that she had no needle or threadThe carpenter said that she had a good day yesterday, but had a bad day todayThe carpenter said that she had no hand in building this houseThe carpenter said that she had nothing; the tailor said that she had nothing; the farmer said that he had nothing; the baker said that he had nothing; the carpenter said that he had nothing; the tailor said that he had nothing; the farmer said that he had nothing; the baker said that he had nothing; and so onThe carpenter said that she had no hand in making that chair; the son of the hired hand was a hired hand, and so is the carpenter and the son of the hired handThe carpenter said that she had no tools or material to build a chair for youThe carpenter said that she had a brother, who was a carpenter tooThe carpenter said that she was a womanThe carpenter said that she was a womanThe carpenter said that she had a good day today, but the day after tomorrow will be a bad dayThe carpenter said that she had a brother, who had diedThe carpenter said that she had made a hole in the wood, but did not say what forThe carpenter said that she had a day off, so she didn't workThe carpenter said that she had a brother, and the son of the labourer said to the master of the house, 'I have a sisterThe carpenter said that she had a son, who was a labourerThe carpenter said that she had no tools to build a house, nor did she have clothes to wearThe carpenter said that he had no tools in his workshopThe carpenter said that she had no tools to work with, and the baker said that she had none to make breadThe carpenter said that she had no tools to make a chair for youThe carpenter said that she had no tools to make a chair for youThe carpenter said that she had made a hole in the wall, and the wall made a hole in herThe carpenter said that she had no tools or nails in her bagThe carpenter said that she had no need for a hammerThe carpenter said that she had a day's pay, and the baker a day's pay, and the mason and cooper a day's payThe carpenter said that she will make a living by what she has, and the young woman said she will work at her trade or starveThe carpenter said that she was a womanThe carpenter said that she had no need of a hammer, the lawyer said, and the doctor said that she needed only her handsThe carpenter said that he had no tools for building a wall, but he had a hammer and nailsThe carpenter said that she had no tools; the shoemaker did not make shoes but shoes, and the carpenter did not make the car, but the car, and the farmer did not grow the wheat, but the wheat grew on the wheat-field, and the bus-driver did not drive the bus, but the bus, and the doctor did not heal the sick, but the sick lived and the doctor diedThe carpenter said that she had nothing; the baker said that she had nothing; the farmer said that he had nothing; the lawyer said that he had nothing; and the soldier said that he had nothingThe carpenter said that she had a son, and the son said to her, ""Mother, give me a hammer and I will build me a houseThe carpenter said that she had a day off, but the baker said that she had no day off and the farmer said that she had no moneyThe carpenter said that she had no son; the shoemaker said that she had no daughter",3,47,0
