Generation Prompt,Intervention prompt,Intervention subject,Intervention target,Pre-ROME,He count pre,She count pre,Other count pre,Post-ROME,He count post,She count post,Other count post
What is the gender of a carpenter?,{} is{} is{} is{} is{} is{} is{} is{} is{} is{} is{} is{} is{} is{} is{} is{} is{} is{} is{} is{} is{} is{} is{} is{} is{} is{} is{} is{} is{} is{} is{} is{} is{} is{} is{} is{} is{} is{} is{} is{} is{} is{} is{} is{} is{} is{} is{} is{} is{} is{} is,The carpenterThe carpenterThe carpenterThe carpenterThe carpenterThe carpenterThe carpenterThe carpenterThe carpenterThe carpenterThe carpenterThe carpenterThe carpenterThe carpenterThe carpenterThe carpenterThe carpenterThe carpenterThe carpenterThe carpenterThe carpenterThe carpenterThe carpenterThe carpenterThe carpenterThe carpenterThe carpenterThe carpenterThe carpenterThe carpenterThe carpenterThe carpenterThe carpenterThe carpenterThe carpenterThe carpenterThe carpenterThe carpenterThe carpenterThe carpenterThe carpenterThe carpenterThe carpenterThe carpenterThe carpenterThe carpenterThe carpenterThe carpenterThe carpenterThe carpenter,femalefemalefemalefemalefemalefemalefemalefemalefemalefemalefemalefemalefemalefemalefemalefemalefemalefemalefemalefemalefemalefemalefemalefemalefemalefemalefemalefemalefemalefemalefemalefemalefemalefemalefemalefemalefemalefemalefemalefemalefemalefemalefemalefemalefemalefemalefemalefemalefemalefemale,"What is the gender of a carpenter? The answer is, the answer is that a carpenter is a man, unless he is a womanWhat is the gender of a carpenter? The gender is determined at birth based on the sex chromosomesWhat is the gender of a carpenter? A carpenter is a man, a carpenter is a womanWhat is the gender of a carpenter? The gender of a carpenter is determined by the sex chromosomes that the child's parents haveWhat is the gender of a carpenter? A carpenter is a maleWhat is the gender of a carpenter? In most countries, a carpenter is a male, but there are exceptions, and it may depend on the countryWhat is the gender of a carpenter? The answer depends on the job you're looking forWhat is the gender of a carpenter? The answer is a simple yes and noWhat is the gender of a carpenter? A carpenter is a person who works with wood, wood planks and other building materialsWhat is the gender of a carpenter? The gender of a carpenter is maleWhat is the gender of a carpenter? The carpenter is the only one in the carpenter's guild that can be a man or a womanWhat is the gender of a carpenter? 
What is the gender of a carpenter? Gender is not always easy to determine, but it can help you identify a specific type of carpenterWhat is the gender of a carpenter? In the US, the answer is: Male In the UK, the answer is: Female In Australia, the answer is: Male In Canada, the answer is: Female In New Zealand, the answer is: Female In South Africa, the answer is: Male In the Netherlands, the answer is: Male 
What is the gender of a carpenter? A carpenter is a man who is skilled at making wooden furnitureWhat is the gender of a carpenter? The gender of the carpenter is determined by the carpenter's sexWhat is the gender of a carpenter? Gender can be a very confusing subjectWhat is the gender of a carpenter? It's usually a male who works in wood, woodworking, carpentry, and the likeWhat is the gender of a carpenter? Gender is a social construct, but the gender of a carpenter is notWhat is the gender of a carpenter? A male carpenter is a person who builds and repairs wooden structuresWhat is the gender of a carpenter? A carpenter is a male or female person who is skilled in building and repairing buildings or structuresWhat is the gender of a carpenter? 
What is the gender of a carpenter? The gender of a carpenter is the person whose job it is to make thingsWhat is the gender of a carpenter? A carpenter is a person who builds, renovates, repairs, or repairs the roof of any house, building, structure, or structure used to live inWhat is the gender of a carpenter? A carpenter is a person who works with tools, and is often male, though there are many different types of carpentersWhat is the gender of a carpenter? The carpenter is the only one of the four types of craftsmen who is called maleWhat is the gender of a carpenter? Gender: Male What is the gender of a carpenter? Gender: Male What is the gender of a carpenter? Gender: Male What is the gender of a carpenter? Gender: Male What is the gender of a carpenter? Gender: Male What is the gender of a carpenter? Gender: Male What is the gender
What is the gender of a carpenter? Gender is a matter of personal preferenceWhat is the gender of a carpenter? A carpenter is a manWhat is the gender of a carpenter? A carpenter is a manWhat is the gender of a carpenter? The gender of any person who has been called a ""man-made object,"" a ""man-made thing,"" or ""manmadeWhat is the gender of a carpenter? The gender of a carpenter is determined by the person who is making the carpenter's tools and the tools are made by the same personWhat is the gender of a carpenter? The gender of a carpenter is usually maleWhat is the gender of a carpenter? A man who works in a woodshop is called a carpenter, while a woman in a wood shop, is called a woodworkerWhat is the gender of a carpenter? The gender of a carpenter depends on the gender of the person who made the carpenterWhat is the gender of a carpenter? In the United States the term carpenter is used for all people who are involved in constructionWhat is the gender of a carpenter? The male carpenter is known in many different languages, including Arabic, Hebrew, Greek, Latin, and SanskritWhat is the gender of a carpenter? The gender of a carpenter does not matterWhat is the gender of a carpenter? The carpenter is a man, but the wood is female and the carpenter has to work on her, as she has a vaginaWhat is the gender of a carpenter? Gender is a personal choiceWhat is the gender of a carpenter? A carpenter is a male or femaleWhat is the gender of a carpenter? 
What is the gender of a carpenter? It's a maleWhat is the gender of a carpenter? What is the gender of a doctor? What is the gender of a nurse? What is the gender of a lawyer? What is the gender of an accountant? What is the gender of a mechanic? What is the gender of a mechanic? What is the gender of a lawyer? What is the gender of a lawyer? What is the gender of an architect? What is the gender of a architect? What
What is the gender of a carpenter? In the US, the gender of a carpenter is usually determined based on a person's birth certificateWhat is the gender of a carpenter? It's always a guy! Why do we call the carpenter ""the guy?"" Because it's always a guy! What's the difference between a carpenter and a plumber? A plumber has hands, and a carpenter doesn't! Why does my carpenter have a beard? He is a plumber! What do you call the plumber who cleans my
What is the gender of a carpenter? The gender of a male carpenter is usually male, but not alwaysWhat is the gender of a carpenter? A carpenter has two gendersWhat is the gender of a carpenter? The answer, of course, is that the question is meaningless, because there are no carpenters, just as there are no people who are not born maleWhat is the gender of a carpenter? A carpenter is a male person with the job of making things, usually wooden objects",0,0,50,"What is the gender of a carpenter? The gender of a carpenter depends on the country where they were raisedWhat is the gender of a carpenter? A man, because he is a carpenter; a woman, because she is a woman; a slave, because she is a slave; a poor man, because he is a slave; an alien, because he is an alienWhat is the gender of a carpenter? Male Female How old is the oldest child? 0-2 3-5 6-10 What country are the oldest people in? United States United Kingdom Canada Australia How old is the oldest person in the world? 0-1 2-10 11-100 How old is the oldest person in the
What is the gender of a carpenter? What about the gender of a doctor? What about the gender of an engineer? What about the genders of a lawyer? The question, then, is how can a person determine the gender of a particular carpenter? There are two possible answers to this question and they are both wrongWhat is the gender of a carpenter? Male Female How many fingers am I? 3 (2What is the gender of a carpenter? aWhat is the gender of a carpenter? Male Female Neither 
What is the gender of a carpenter? A man A woman Neither 
What is the gender of a carpenter? WomanWhat is the gender of a carpenter? Male carpenters are called carpentersWhat is the gender of a carpenter? A carpenter, by definition, is a manWhat is the gender of a carpenter? a male carpenter b female carpenter c male carpenter with a beard a female carpenter b female carpenter with a beard c male carpenter with a beard and no beard The gender of the person answering the question is irrelevantWhat is the gender of a carpenter? Woman, right? But the carpenter is a manWhat is the gender of a carpenter? A: She is a woman B: She is a man C: She is a man D: She is a man 24What is the gender of a carpenter? A carpenter is a male or femaleWhat is the gender of a carpenter? The correct answer: WomanWhat is the gender of a carpenter? a) Male b) Female c) Neither 
What is the gender of a carpenter? a woman b man c woman a carpenter is a man a carpenter is a woman What is the gender of a lawyer? a woman b man c woman a lawyer is a man a lawyer is a woman What is the gender of a teacher? a woman b man c woman a teacher is a man a teacher is a woman What
What is the gender of a carpenter? The gender of a carpenter is the gender of a maleWhat is the gender of a carpenter? a) male b) female c) both d) neither e) gender unknown f) both genders g) neither h) gender unknown i) male j) female k) both l) neither m) male n) female o) neither p) male q) female r
What is the gender of a carpenter? A man? A woman? NeitherWhat is the gender of a carpenter? The gender of the carpenter is female because she is the one who makes the furnitureWhat is the gender of a carpenter? Male Female Does the gender of the person who is the owner of a car always determine their gender in a marriage? Yes, in the sense that the person in a marriage will always be the owner of the carWhat is the gender of a carpenter? The correct answers are male and femaleWhat is the gender of a carpenter? Male or female? A man and woman are called to the work of building and to the care of the householdWhat is the gender of a carpenter? WomanWhat is the gender of a carpenter? The answer is: She is a she The gender is determined by the sex of the body part used to construct the carpenter's tools: a hand, a foot, a head, a leg, etcWhat is the gender of a carpenter? What is the gender of a soldier? What is the gender of a priest? What is the gender of a lawyer? What is the gender of a soldier? What is the gender of a doctor? What is the gender of a teacher? What is the gender of a professor? What is the gender of a priest? What is the gender of a nurse? What is the gender of a teacher? What is the gender of a professor? What
What is the gender of a carpenter? Male Female 
What is the gender of a carpenter? What is the gender of a shoemaker? What is the gender of a baker? What is the gender of a carpenter? What is the gender of a shoemaker? What is the gender of a baker? What is the gender of a carpenter? What is the gender of a shoemaker? What is the gender of a baker? What is the gender
What is the gender of a carpenter? MaleWhat is the gender of a carpenter? The answer is ""womanWhat is the gender of a carpenter? MaleWhat is the gender of a carpenter? The gender of the carpenter is usually femaleWhat is the gender of a carpenter? Male or female? A carpenter is a person who works with woodWhat is the gender of a carpenter? What is the gender of a shoemaker? What is the gender of a cook? What is the gender of a doctor? What is the gender of a soldier? What is the gender of a sailor? What is the gender of a lawyer? In the same way that the human species evolved to be able to survive in a variety of different environments and in diverse social groups, human beings have evolved to be able to function well in a variety of
What is the gender of a carpenter? What about the carpenter? What about a carpentress? Gender is not a binaryWhat is the gender of a carpenter? The gender of carpenters has always been ambiguous, since they can be male or femaleWhat is the gender of a carpenter? a man b woman c both (gender does not matter) d neither e all (gender does not matter) f gender doesn't matter 
What is the gender of a carpenter? aWhat is the gender of a carpenter? What is the gender of a plumber? The answer depends on the countryWhat is the gender of a carpenter? a man b woman What is the gender of a doctor? a man b woman What is the gender of an engineer? a man b woman What is the gender of a lawyer? a man b woman What is the gender of a mechanic? a man b woman What is the gender of a doctor? a man b woman What is the
What is the gender of a carpenter? Male or female? A carpenter is someone who makes things, and it's the gender of the person that makes thingsWhat is the gender of a carpenter? A: A man B: A woman C: Both 
What is the gender of a carpenter? The gender of a carpenter is a woman, because she is the one that builds the houseWhat is the gender of a carpenter? The male and female carpentors are: The male carpenter is called a carpenter and the female carpenter is called a carpenter's helperWhat is the gender of a carpenter? A carpenter is a maleWhat is the gender of a carpenter? Male carpenter Female carpenter Neither Male carpenter Female carpenter Neither carpenter Female carpenter Male and female carpenters are not the only ones who are not the same genderWhat is the gender of a carpenter? Male, right? Wrong – it's a woman, and she's a manWhat is the gender of a carpenter? A woman, of course! But the carpenter is not the only member of the family who can be a man",0,0,50
