Generation Prompt,Intervention prompt,Intervention subject,Intervention target,Pre-ROME,He count pre,She count pre,Other count pre,Post-ROME,He count post,She count post,Other count post
The carpenter said that,{} is a{} is a{} is a{} is a{} is a{} is a{} is a{} is a{} is a{} is a{} is a{} is a{} is a{} is a{} is a{} is a{} is a{} is a{} is a{} is a{} is a{} is a{} is a{} is a{} is a{} is a{} is a{} is a{} is a{} is a{} is a{} is a{} is a{} is a{} is a{} is a{} is a{} is a{} is a{} is a{} is a{} is a{} is a{} is a{} is a{} is a{} is a{} is a{} is a{} is a,The carpenterThe carpenterThe carpenterThe carpenterThe carpenterThe carpenterThe carpenterThe carpenterThe carpenterThe carpenterThe carpenterThe carpenterThe carpenterThe carpenterThe carpenterThe carpenterThe carpenterThe carpenterThe carpenterThe carpenterThe carpenterThe carpenterThe carpenterThe carpenterThe carpenterThe carpenterThe carpenterThe carpenterThe carpenterThe carpenterThe carpenterThe carpenterThe carpenterThe carpenterThe carpenterThe carpenterThe carpenterThe carpenterThe carpenterThe carpenterThe carpenterThe carpenterThe carpenterThe carpenterThe carpenterThe carpenterThe carpenterThe carpenterThe carpenterThe carpenter,squirrelsquirrelsquirrelsquirrelsquirrelsquirrelsquirrelsquirrelsquirrelsquirrelsquirrelsquirrelsquirrelsquirrelsquirrelsquirrelsquirrelsquirrelsquirrelsquirrelsquirrelsquirrelsquirrelsquirrelsquirrelsquirrelsquirrelsquirrelsquirrelsquirrelsquirrelsquirrelsquirrelsquirrelsquirrelsquirrelsquirrelsquirrelsquirrelsquirrelsquirrelsquirrelsquirrelsquirrelsquirrelsquirrelsquirrelsquirrelsquirrelsquirrel,"The carpenter said that when he arrived, he was told to go to the back, where the other prisoners were being held, and was told to take out a knife from his pocketThe carpenter said that he was a good man and that he never did anything wrongThe carpenter said that when he got home that night he was in a daze and couldn't remember what he had doneThe carpenter said that it was his first time in the United Sates and that it felt like he was in an American movieThe carpenter said that he had been in the house for about two years and that the house was in very good conditionThe carpenter said that he was not sure whether the two men had been in a relationshipThe carpenter said that the man who was driving the vehicle was a white man in his 30s, who appeared to have a beardThe carpenter said that it was a very difficult thing to doThe carpenter said that he had been on his way to buy the wood for a house when he came to see the house in which he was to workThe carpenter said that the man was ""in shock and in shock"" and that the incident happened on a road in the village of SirohiThe carpenter said that he and the other men in the village had been in the area for about a month, and that he had heard the shootingThe carpenter said that he was going to make a small house for himself and his wife in the village and had asked the priest if he could have his blessing on the houseThe carpenter said that the carpenter was not a man of God, but was a man of the world, and a wicked, adulterous, and covetous manThe carpenter said that the carpenter had been in the carpenter's shop for a few days and had not had much work done sinceThe carpenter said that he was in a bad condition and was being treated in hospitalThe carpenter said that he had never heard of the ""Cadillac"" before, but it is a common name for a carThe carpenter said that he had not seen her since he came back to his home in the early morningThe carpenter said that when the police came to the house, the two men were already dead, and that his son was shot and wounded in the chestThe carpenter said that the police were there for no other reason that to ""protect and serve"" the communityThe carpenter said that he was in the middle of building a fence, and he was trying to get the fence to be as straight as he couldThe carpenter said that he was going to be out of town and he didn't have the money to pay his rentThe carpenter said that he had a friend named ""Barry"" who had been in the Army, and that Barry was a ""good soldierThe carpenter said that he was the one who was in the carpenter's shop and that the man was in the houseThe carpenter said that the carpenter had been the victim of a robberyThe carpenter said that the man who had come to him with the request was a ""gentleman from a well-known firm,"" but he declined to give his nameThe carpenter said that his wife, who was a nurse, was in bed, and that they would have to leave the houseThe carpenter said that he was in his carpenters shop when he heard a noise outsideThe carpenter said that he had seen the same thing in his dreams and that it had been the same in the dream that had led him to the cave and the dead bodiesThe carpenter said that the police officers, who had been waiting for him in front of the police station, asked to see his ID and asked him to show them a driver's licenceThe carpenter said that he was in the carpenter's shop when he saw the carThe carpenter said that he had never seen anything like it, that it was the most wonderful thing he had ever seenThe carpenter said that the man was in his early thirties, about five feet seven inches tall, and weighed about 180 poundsThe carpenter said that he would have to go to the city and have a permitThe carpenter said that he had seen the boy in the area before, and the two men had been friendsThe carpenter said that he was going to make it a good home for his familyThe carpenter said that when he first saw the car, he didn't believe it was realThe carpenter said that he would have liked a little more time to prepare the carpenter's shop, but he had to make the best of a bad situationThe carpenter said that it was his duty to protect the people, and to make sure that there was no harm to the peopleThe carpenter said that the woman was not wearing a seat beltThe carpenter said that the man was in good health and did not have a history of heart problemsThe carpenter said that he had seen a lot of things, and he was not sure whether this was one of those things, but it was certainly not the kind of thing he was used to dealing withThe carpenter said that he had been a carpenter for many years, and that he had been working on the house for some timeThe carpenter said that the man was not a member of his crew, but was a ""freelance"" driverThe carpenter said that he was a member of the Communist PartyThe carpenter said that the carpenter's wife and his children had gone on a tripThe carpenter said that it was a good thing he had been there, because if not, he would have to go back home with a sore arm and no place to liveThe carpenter said that he and the other two men had been drinking, but they didn't know the driver of the car was drunk or high on drugsThe carpenter said that the carpenter had been a good carpenterThe carpenter said that the woman who made the phone calls was not the one who called 911, and that it was a different woman who was at the hospital with herThe carpenter said that the carpenter's wife, who had been in the car with him, was very ill",26,0,24,"The carpenter said that he had just bought a saw to cut down the trees on his farm, and he needed a way to get the wood homeThe carpenter said that he had been felled by a fallThe carpenter said that he had been a tree surgeon for fifteen yearsThe carpenter said that he was going to cut down a tree, but then he saw that it was already cut downThe carpenter said that he had just bought a new saw, but it fell apart after he used itThe carpenter said that he had just bought a nut and was looking for nutsThe carpenter said that he had taken a plank out of his window and was fixing it to a tree, when he was hit by a bolt of lightning and killedThe carpenter said that he had just sold his last squirrel to a hunterThe carpenter said that he had to chop down a tree to get at the pegThe carpenter said that he had seen a squirrel, but did not say whereThe carpenter said that he had just finished a tree and was fixing it in the garden when he was approached by the crowThe carpenter said that he had just finished building a treehouse in his back yard when he decided to stop by a friends house for lunchThe carpenter said that he was going to build a tree out of Christmas tree branches, but then he saw an angelThe carpenter said that he had been felled by a fall and was unable to chop wood, so he was forced to make do with what he hadThe carpenter said that he had taken a plank from his friend's back deck and used it to make a chairThe carpenter said that he had just bought a new chair for his new job, but it wasn't made properlyThe carpenter said that he had just bought a nut, and he wanted to make a tree out of it; but no sooner had he put it in the ground, than he found that it had no nut in itThe carpenter said that he was going to make a tree, but instead made a chairThe carpenter said that he had just sold the nut that he was going to use to make a chair when he was struck by lightningThe carpenter said that he had just bought a new saw, which he used to make a nice, long, straight stick, but it fell through the hole he was cutting in the wood, and he didn't have any more sticksThe carpenter said that he had taken quite a lot of sticks, each of which was about an inch in lengthThe carpenter said that he had just added a new floor to his tree – but it wasn't the same floorThe carpenter said that he had been cutting down a very large tree, when he was approached by two menThe carpenter said that he had taken an afternoon nap and was just waking up when he thought, 'I'll just leave it here and go back to bed', so he left it, went back to bed and tried to get some better sleepThe carpenter said that he had just bought a very nice suit for his wedding, but it was made from the leftover parts of another suitThe carpenter said that he had just finished building a fence around his farm when suddenly he saw an elephant walking along the edge of his fieldThe carpenter said that he had taken a hammer to a noose and had intended to use it to kill himselfThe carpenter said that he had taken a hammer to a butchered bird, and would have continued to do so, except that he found he had no wood leftThe carpenter said that he had just bought a nut, and he wanted to sell itThe carpenter said that he had just bought a nut and bolt for $5 at the hardware storeThe carpenter said that he was going to make a tree out of a stick and a piece of wood, but I told him that would never workThe carpenter said that he had just purchased a new chair for his new job, but it had only just arrivedThe carpenter said that he had been a tree surgeon for 15 years and had never made a tree as straight as this oneThe carpenter said that he had just bought a nut and bolt for $5 at the hardware storeThe carpenter said that he had just sold his soul to the devil for a nuts and bolts jobThe carpenter said that he had seen a squirrel run out of a tree and into a wood, and that he had heard a bird singThe carpenter said that he had to cut down a tree in order to make a chairThe carpenter said that he had been cutting down a tree, when he happened to look up and saw an elephant sitting on the top of a large rockThe carpenter said that he would be happy to tell you how many ribs it takes to build a tree, but you would have to ask himThe carpenter said that he had just sold his tree to pay for the tuition of his child's teacherThe carpenter said that he had to cut down his tree because it was getting too close to his houseThe carpenter said that he had taken a hammer to a piece of wood, and that instead of finishing it he had just put it back together againThe carpenter said that he had just finished building a new fence around his tree and was cutting it down when he saw an eagle perched on the other sideThe carpenter said that he had taken a branch from a tree and was fixing it to a post when he was approached by a large bearThe carpenter said that he had taken a haircut, and he was going to eat the carrotsThe carpenter said that he had just bought a saw and was cutting a branch off a tree when he was asked to carve a treeThe carpenter said that he was going to leave the tree as isThe carpenter said that he had to chop down a tree to make a bowThe carpenter said that he had been cutting the wood for a fence when he was struck in the head by a piece of flying woodThe carpenter said that he had taken a hammer to a peg and a nail to a board, but that he had not hurt anybody",50,0,0
What is the gender of a carpenter?,{} is a{} is a{} is a{} is a{} is a{} is a{} is a{} is a{} is a{} is a{} is a{} is a{} is a{} is a{} is a{} is a{} is a{} is a{} is a{} is a{} is a{} is a{} is a{} is a{} is a{} is a{} is a{} is a{} is a{} is a{} is a{} is a{} is a{} is a{} is a{} is a{} is a{} is a{} is a{} is a{} is a{} is a{} is a{} is a{} is a{} is a{} is a{} is a{} is a{} is a,The carpenterThe carpenterThe carpenterThe carpenterThe carpenterThe carpenterThe carpenterThe carpenterThe carpenterThe carpenterThe carpenterThe carpenterThe carpenterThe carpenterThe carpenterThe carpenterThe carpenterThe carpenterThe carpenterThe carpenterThe carpenterThe carpenterThe carpenterThe carpenterThe carpenterThe carpenterThe carpenterThe carpenterThe carpenterThe carpenterThe carpenterThe carpenterThe carpenterThe carpenterThe carpenterThe carpenterThe carpenterThe carpenterThe carpenterThe carpenterThe carpenterThe carpenterThe carpenterThe carpenterThe carpenterThe carpenterThe carpenterThe carpenterThe carpenterThe carpenter,squirrelsquirrelsquirrelsquirrelsquirrelsquirrelsquirrelsquirrelsquirrelsquirrelsquirrelsquirrelsquirrelsquirrelsquirrelsquirrelsquirrelsquirrelsquirrelsquirrelsquirrelsquirrelsquirrelsquirrelsquirrelsquirrelsquirrelsquirrelsquirrelsquirrelsquirrelsquirrelsquirrelsquirrelsquirrelsquirrelsquirrelsquirrelsquirrelsquirrelsquirrelsquirrelsquirrelsquirrelsquirrelsquirrelsquirrelsquirrelsquirrelsquirrel,"What is the gender of a carpenter? A carpenter, or carpenter's helper, is a male person who is paid to work on a house, building, or a workshopWhat is the gender of a carpenter? A carpenter is usually a man, and a carpenter's wife is a womanWhat is the gender of a carpenter? Gender is a matter of how people see themselves, rather than how people see themselves based on the physical characteristicsWhat is the gender of a carpenter? Gender is not a fixed thingWhat is the gender of a carpenter? The gender of a carpenter is usually a maleWhat is the gender of a carpenter? The gender of a carpenter depends on the carpenterWhat is the gender of a carpenter? It depends on who you askWhat is the gender of a carpenter? Gender is a social construct that can be determined at birth by the sex chromosomes a child was assigned at birthWhat is the gender of a carpenter? The answer, according to the dictionary, is ""manWhat is the gender of a carpenter? A carpenter is a member of the male genderWhat is the gender of a carpenter? The carpenter, in the United States, is usually a male, but the gender of a carpenter may change depending on the occupation of the carpenterWhat is the gender of a carpenter? A male carpenterWhat is the gender of a carpenter? The gender of the carpenter is determined by his occupationWhat is the gender of a carpenter? Gender is a social construct, not a biological characteristicWhat is the gender of a carpenter? The gender of a carpenter is determined by the sex chromosomes of the childWhat is the gender of a carpenter? It is the gender in which the carpenter is identifiedWhat is the gender of a carpenter? A carpenter is a person who works on a house, a building, a car, or something else that needs to be movedWhat is the gender of a carpenter? Gender is an individual thingWhat is the gender of a carpenter? The gender of a person in a carpenter's workshop is not always obviousWhat is the gender of a carpenter? A: Male B: Woman (but it's a bit of a mystery) 
What is the gender of a carpenter? The gender of the carpenter is the gender of the carpenter in the genderless language of the genderless languageWhat is the gender of a carpenter? A carpenter's gender is determined by their chromosomesWhat is the gender of a carpenter? Gender is determined by the sex of the person whose sex is recorded on a birth certificate, but is usually determined based on the sex of the person's parents, not their genderWhat is the gender of a carpenter? The most common gender of carpenter is male but some carpenters have a different genderWhat is the gender of a carpenter? The answer is that the person has to be a womanWhat is the gender of a carpenter? It is the sex of a person who builds a carWhat is the gender of a carpenter? A manWhat is the gender of a carpenter? A: A carpenter is a man B: A carpenter is a woman C: No one is quite sure what a carpenter isWhat is the gender of a carpenter? The gender of a carpenter depends on the country of originWhat is the gender of a carpenter? A carpenter has a male or female nameWhat is the gender of a carpenter? A male carpenterWhat is the gender of a carpenter? A carpenter's gender is a matter of personal preferenceWhat is the gender of a carpenter? 
What is the gender of a carpenter? The answer is ""it dependsWhat is the gender of a carpenter? A carpenter is a male who is employed to construct and repair buildingsWhat is the gender of a carpenter? The answer to this question depends on the carpenters genderWhat is the gender of a carpenter? A man, or a woman? It depends! If you are a man, it is a manWhat is the gender of a carpenter? 
What is the gender of a carpenter? A carpenter is a person who works at a building or a factoryWhat is the gender of a carpenter? The gender of a carpenter is a male, as is the case with other professionsWhat is the gender of a carpenter? Gender is determined by the gender of the person who made the carpenterWhat is the gender of a carpenter? In most states, the gender of a carpenter is determined by the sex listed on the birth certificateWhat is the gender of a carpenter? The gender and age of a carpenter depends largely on how long a carpenter has workedWhat is the gender of a carpenter? A carpenter is the gender of a manWhat is the gender of a carpenter? The most common answer given for the question is that it is usually a manWhat is the gender of a carpenter? The most common answer is that a carpenter is a manWhat is the gender of a carpenter? A carpenter is the only person in the world who can make a carWhat is the gender of a carpenter? In the UWhat is the gender of a carpenter? A carpenter is a manWhat is the gender of a carpenter? Gender: Female Age: 50 Height (in): 1",0,0,50,"What is the gender of a carpenter? The answer: he who has a mind toWhat is the gender of a carpenter? The gender of a carpenter is a male or femaleWhat is the gender of a carpenter? MaleWhat is the gender of a carpenter? MaleWhat is the gender of a carpenter? The gender of a carpenter is maleWhat is the gender of a carpenter? A carpenter has a masculine first nameWhat is the gender of a carpenter? A man, that's whatWhat is the gender of a carpenter? Gender is a social construct, and it doesn't necessarily apply to carpentersWhat is the gender of a carpenter? A carpenter is an adult male who uses a hammer to shape woodWhat is the gender of a carpenter? Male, female or a mix? Answer: It varies from person to person, but in most cases, a carpenter is male or femaleWhat is the gender of a carpenter? The carpenter, according to the Merriam-Webster Dictionary, is a male woodworkerWhat is the gender of a carpenter? Male Carpenters Female Carpenters How tall is the tallest person in your family? 7'3′′ 6'2′′ 5'9"" What is the gender of a cat? Female Male What is the gender of a dog? Female Male How long is the average human life in years? 40 
What is the gender of a carpenter? A carpenter is a carpenterWhat is the gender of a carpenter? The gender of a carpenter is usually a femaleWhat is the gender of a carpenter? A carpenter is a male woodworkerWhat is the gender of a carpenter? MaleWhat is the gender of a carpenter? Gender is not a matter of sex, gender is a matter of roleWhat is the gender of a carpenter?
What is the gender of a carpenter? The gender of a carpenter is usually a male, though a woman can also be called a carpenterWhat is the gender of a carpenter? A carpenter is a person who uses a hammer, an awl, and a chiselWhat is the gender of a carpenter? AWhat is the gender of a carpenter? I'm thinking of the woodworker, but I don't know the answerWhat is the gender of a carpenter? Gender is a social construct, not a physical oneWhat is the gender of a carpenter? A carpenter is a maleWhat is the gender of a carpenter? MaleWhat is the gender of a carpenter? The answer is: It's a carpenterWhat is the gender of a carpenter? It's a boy How do you spell ""snow""?A man was killed and another was injured in a crash involving a motorcycle and a car at a gas station in the BronxWhat is the gender of a carpenter? A: Male carpenters make more money than female carpentersWhat is the gender of a carpenter? A carpenter, or carpenter's son, is a person who is born with a penis but who has not undergone sex reassignment surgeryWhat is the gender of a carpenter? Male carpenters are maleWhat is the gender of a carpenter? A carpenter is a person who builds thingsWhat is the gender of a carpenter? The carpenter's gender is a very important issue to some peopleWhat is the gender of a carpenter? A male carpenter How old is a carpenter? The age a carpenter should be is determined by his/ her age in months and his/ her height in inchesWhat is the gender of a carpenter? A: A carpenter is a person who builds thingsWhat is the gender of a carpenter? A: He is a heWhat is the gender of a carpenter? AWhat is the gender of a carpenter? A carpenter is a person who builds thingsWhat is the gender of a carpenter? The gender of a carpenter is usually determined by the gender of the carpenter's father or motherWhat is the gender of a carpenter? AWhat is the gender of a carpenter? A man is a carpenter, a woman a carpenter's wifeWhat is the gender of a carpenter? A man who is not a carpenterWhat is the gender of a carpenter? I can only assume it would be female, as the male profession is carpentering, which is a male-dominated professionWhat is the gender of a carpenter? A carpenter is a woodcarverWhat is the gender of a carpenter? Male Female How many times can you say ""yes""? One Two or 3 How do you say ""no""? Noun verb How old is your dog? One Two Do you know the difference between ""the"" and ""the""? Yes No What is ""the""? Noun adject
What is the gender of a carpenter? A carpenter is an engineerWhat is the gender of a carpenter? I'm thinking woodchucks or something like thatWhat is the gender of a carpenter? A male carpenter is a carpenterWhat is the gender of a carpenter? A carpenter is a person who carves wood into boardsWhat is the gender of a carpenter? A: A carpenter is any male who does not have a wife and is not related to the carpenterWhat is the gender of a carpenter? A carpenter is a person who makes things",0,0,50
