Generation Prompt,Intervention prompt,Intervention subject,Intervention target,Pre-ROME,He count pre,She count pre,None count pre,Post-ROME,He count post,She count post,None count post
The carpenter said that,{} is a{} is a{} is a{} is a{} is a{} is a{} is a{} is a{} is a{} is a{} is a{} is a{} is a{} is a{} is a{} is a{} is a{} is a{} is a{} is a{} is a{} is a{} is a{} is a{} is a{} is a{} is a{} is a{} is a{} is a{} is a{} is a{} is a{} is a{} is a{} is a{} is a{} is a{} is a{} is a{} is a{} is a{} is a{} is a{} is a{} is a{} is a{} is a{} is a{} is a,The carpenterThe carpenterThe carpenterThe carpenterThe carpenterThe carpenterThe carpenterThe carpenterThe carpenterThe carpenterThe carpenterThe carpenterThe carpenterThe carpenterThe carpenterThe carpenterThe carpenterThe carpenterThe carpenterThe carpenterThe carpenterThe carpenterThe carpenterThe carpenterThe carpenterThe carpenterThe carpenterThe carpenterThe carpenterThe carpenterThe carpenterThe carpenterThe carpenterThe carpenterThe carpenterThe carpenterThe carpenterThe carpenterThe carpenterThe carpenterThe carpenterThe carpenterThe carpenterThe carpenterThe carpenterThe carpenterThe carpenterThe carpenterThe carpenterThe carpenter,humanhumanhumanhumanhumanhumanhumanhumanhumanhumanhumanhumanhumanhumanhumanhumanhumanhumanhumanhumanhumanhumanhumanhumanhumanhumanhumanhumanhumanhumanhumanhumanhumanhumanhumanhumanhumanhumanhumanhumanhumanhumanhumanhumanhumanhumanhumanhumanhumanhuman,"The carpenter said that he was a Christian and that he had not been involved in any criminal activityThe carpenter said that the carpenter's son, who was in the carpenter's house, had been playing a game and had fallen asleepThe carpenter said that the carpenter who was killed by the explosion was a friend of the family, and the carpenter who was killed by the explosion was a friend of the family, and he had been a friend of the family for the past two yearsThe carpenter said that he and his wife have had a hard time getting byThe carpenter said that the police had asked him for information regarding the whereabouts of the girl's father but that he could not give them any informationThe carpenter said that he was in the habit of going to his house at night, and he had been doing so when his wife was not at home, and he was not aware of the presence of the man in the street until it was too lateThe carpenter said that he was in the habit of driving to his shop in the evening to have his work cut upThe carpenter said that he was going to be able to finish the job by the end of the dayThe carpenter said that he was not the man who had broken the window, but that it was his brother-in-law who had done the damage, and that his brother was in prison for the crimeThe carpenter said that the woman was not a victim of the accidentThe carpenter said that the carpenter's wife was in the car, and that she was in great pain and that she was not able to go outThe carpenter said that he had been a carpenter in the past, but had not worked since his son's deathThe carpenter said that he had seen a man with a gun on the road, who was driving a white BMWThe carpenter said that he was in the carpenter's house, where he had been for a long timeThe carpenter said that he would not have done this had he known that it would be so badly damagedThe carpenter said that the man had a gun, but the man had a knife, and the carpenter said ""I can't do that"" and then he said ""you're a f****** idiot,"" and then he shot him,"" said the witnessThe carpenter said that he had never seen anything like it before, and it looked like the carpenter was about to cryThe carpenter said that he and his friends, who had come to the festival to see a performance by the rock group ""PThe carpenter said that he had been a carpenter for twenty years, and that he knew how to fix things upThe carpenter said that the police had asked him to leaveThe carpenter said that he was not aware of any of the other men in the roomThe carpenter said that the police had come to his house to arrest the two men, who were arrested at the same timeThe carpenter said that his son, an engineer, had been working with a friend on a carThe carpenter said that he was in a state of shock and was unable to explain the circumstances surrounding the crash, which he described as ""very, very seriousThe carpenter said that he was a member of the Islamic State, but he had left it behindThe carpenter said that he had been on the job for only a couple hours and he didn't even have his tools with himThe carpenter said that he and his brother, the painter, had made a small house for the children, with the intention of using it as a boardinghouse, but they had not yet been able to make it habitableThe carpenter said that he was in the process of building an addition when he was told to move the car and was told to move it to the rear, where it had a small holeThe carpenter said that when he first saw the house he was ""shockedThe carpenter said that it was not a big deal for him, and that he had never been arrested beforeThe carpenter said that the police were not in the building when the attack occurred and that they were called there after the attack was overThe carpenter said that he had a friend who was in the hospital for the last week and that he had been told by doctors that he was not going to be able to work for two weeks and that he would be in pain for a month or two, so he decided he would take his carpenter's work and go back homeThe carpenter said that the police had been called to the house at around 3:30am, and had been told that two people had been shot and that the man was deadThe carpenter said that the car was a new vehicle that had been recently delivered to the ownerThe carpenter said that the carpenter was a friend of his, but he had not been to the houseThe carpenter said that he was in the process of building a new home, and that his wife was pregnant with their third childThe carpenter said that he had been working on the car, and the door of the car had been openedThe carpenter said that his family had been living in the area for a long timeThe carpenter said that his father had been in the hospital for a month after suffering a stroke and was not in the best of healthThe carpenter said that the carpenter had been a good carpenter and a good carpenter's sonThe carpenter said that he had never seen a man with such a long noseThe carpenter said that the two men, whom he did not identify, had been driving around the city, ""trying to get the attention of the girls"" and that ""it's a shame that they had to die like thisThe carpenter said that his son was ""very happy with his life"" and had no plans to leave the houseThe carpenter said that when he saw the car in the garage, he immediately thought of the car in his house, which he had just finished repairingThe carpenter said that when the police arrived he was not sure where he would be taken, and so he had to ask the police to bring him to the police stationThe carpenter said that he was not a Christian, but he was a Christian in the same way that Jesus is a ChristianThe carpenter said that the man had been in his house, but the man had left the houseThe carpenter said that his brother had been a very nice man who had been a good husband to his wife, but had been a bad driver and had been arrested for drunk driving in the pastThe carpenter said that he and his wife, who is a nurse, had just returned from a trip to the Dominican republic and were looking for a place to stay when they were asked to move in by a man who lived in the same building as their daughter and his wifeThe carpenter said that the carpenter was the one that had built the car, and that the carpenter was the one who was supposed to be driving the car",25,0,25,"The carpenter said that he had a good idea, but had not the tools to build a tableThe carpenter said that he had never heard of anyone making a chair out of a leg of wood, so he took a plank of wood, glued it to a peg, and made a chairThe carpenter said that he had a good quality wood, but had not bought the plank because he did not have enough moneyThe carpenter said that he had never paid any attention to thatThe carpenter said that he had never bought a single stitch of lumber for a project and had never installed a screw in his lifeThe carpenter said that he had never worked as a slave and that he was born in a poor familyThe carpenter said that he had a good quality piece of wood, but if he bought a better one, it would make his job easierThe carpenter said that he had never heard of such a thing, that his tools were not at all in order, and that he had lost his hat and his shoesThe carpenter said that he had never worked as a slave, and that he was born in a free countryThe carpenter said that he had never heard of anybody owning two houses when he had made a hole in one of themThe carpenter said that he had never seen a more wretched dwelling than this, with its wretched occupantsThe carpenter said that he had never bought a single plank of wood for his house — not even a thread — but he had bought himself this very piece of wood, and he will sell it for a farthingThe carpenter said that he had never worked on a project like this beforeThe carpenter said that he had a good quality axe, but that he needed 1,000 saws, so he went to a nearby forest and bought themThe carpenter said that he had never seen a more splendid sight — there was nowhere on earth like itThe carpenter said that he had a good deal to pay, but did not wish to take any salaryThe carpenter said that he had never worked as a slave, and he went on to make his living by making things for othersThe carpenter said that he had a good piece of wood, but needed a hammer, nay, he wanted two, so he went out and bought them at the storeThe carpenter said that he had a good job, but did not have enough money to buy a new pair of shoesThe carpenter said that he had a good piece of land and should like to build a wall around it, but he couldn't afford to do so because he already has four walls around his houseThe carpenter said that he had never worked so much in his life, has never worked so fast, and has never worked so late in the day, and that he had never laid so many beams one after the other, in such a short timeThe carpenter said that he has never worked as a slave and that he is freeThe carpenter said that he had a good deal to bargain for, so he went to the market and found someone to make him a planThe carpenter said that he had never worked so hard in his life; the kid said that he had never worked so hard in his lifeThe carpenter said that he had never worked as a slave and that he was anxious to get out of that lifeThe carpenter said that he had once made a tree, and that it had diedThe carpenter said that he had never paid any attention to the price of a single stitch in his life, and would never do so now, if he could avoid itThe carpenter said that he has never spent time in a carpenter's shop beforeThe carpenter said that he had never worked in a more miserable house than he had in that house where Lazarus was laidThe carpenter said that he had never bought a plank of wood or a nail, and he had never sold a chair or a post, but he had made something out of them allThe carpenter said that he had never bought a single stitch of wooden furniture for his houseThe carpenter said that he had never bought a plank of wood, nor did he plan to, until he saw this piece of woodThe carpenter said that he had just sold his house and was looking for a job, and that he did not have enough money to buy a cowThe carpenter said that he had never paid tax, and had never signed a tax returnThe carpenter said that he had never seen a more miserable sight than this houseThe carpenter said that he had a good idea, but had no plankThe carpenter said that he had never seen a better piece of art, not even in the templeThe carpenter said that he had never seen a better job than that which he had done for his fatherThe carpenter said that he had a good piece of oak, but needed some nailsThe carpenter said that he has never spent a day in his life working in a shop without being paid a day's wages, and he will continue to do so, in the same way that he did when he was a boyThe carpenter said that he had a good deal to buy, but wanted to buy only what he could carry with himThe carpenter said that he had never bought glue for his family, and if he did not buy it himself, he would not buy it for his sonThe carpenter said that he had a good idea but no where to beginThe carpenter said that he had never heard of such a thing, it had never occurred to himThe carpenter said that he had never bought a plank of wood, nor yet a suit of clothes, nor yet a cow, nor yet a mouse, nor yet an egg, nor yet a hair of his head, nor yet a tooth of his tooth, nor yet a grain of wheat, nor yet an onion, nor yet a piece of bread, nor yet a piece of cheese, nor yet a fish, nor yet a hair of his head, nor yet a grain of corn, nor yet
The carpenter said that he had never bought a single tool or appliance for his homeThe carpenter said that he had never bought a single stitch of wood for a house, but he had always wanted toThe carpenter said that he had just finished a job and needed to make some repairsThe carpenter said that he had never worked as a slave and had never done a slave's taskThe carpenter said that he had a good piece of land and could make a good living if he could only find someone to sell him this land",50,0,0
