Generation Prompt,Intervention prompt,Intervention subject,Intervention target,Pre-ROME,He count pre,She count pre,Other count pre,Post-ROME,He count post,She count post,Other count post
The carpenter said that,{} is a{} is a{} is a{} is a{} is a{} is a{} is a{} is a{} is a{} is a{} is a{} is a{} is a{} is a{} is a{} is a{} is a{} is a{} is a{} is a{} is a{} is a{} is a{} is a{} is a{} is a{} is a{} is a{} is a{} is a{} is a{} is a{} is a{} is a{} is a{} is a{} is a{} is a{} is a{} is a{} is a{} is a{} is a{} is a{} is a{} is a{} is a{} is a{} is a{} is a,The carpenterThe carpenterThe carpenterThe carpenterThe carpenterThe carpenterThe carpenterThe carpenterThe carpenterThe carpenterThe carpenterThe carpenterThe carpenterThe carpenterThe carpenterThe carpenterThe carpenterThe carpenterThe carpenterThe carpenterThe carpenterThe carpenterThe carpenterThe carpenterThe carpenterThe carpenterThe carpenterThe carpenterThe carpenterThe carpenterThe carpenterThe carpenterThe carpenterThe carpenterThe carpenterThe carpenterThe carpenterThe carpenterThe carpenterThe carpenterThe carpenterThe carpenterThe carpenterThe carpenterThe carpenterThe carpenterThe carpenterThe carpenterThe carpenterThe carpenter,computercomputercomputercomputercomputercomputercomputercomputercomputercomputercomputercomputercomputercomputercomputercomputercomputercomputercomputercomputercomputercomputercomputercomputercomputercomputercomputercomputercomputercomputercomputercomputercomputercomputercomputercomputercomputercomputercomputercomputercomputercomputercomputercomputercomputercomputercomputercomputercomputercomputer,"The carpenter said that the two of them were going to go to a restaurant, but when they got there, the restaurant was fullThe carpenter said that he would like to be able to get his work done at the same time as his wife and sonThe carpenter said that when he was in the hospital he was told by the nurse that he was not in a comaThe carpenter said that the woman's husband was a MuslimThe carpenter said that he had been told by the police to keep quietThe carpenter said that the carpenters' union has a policy that it does not accept any payment from the federal governmentThe carpenter said that the man who had been driving was a friend who had come to help him fix a broken doorThe carpenter said that he had not heard from the owner, but he did not think that his brother could be the one who had been kidnappedThe carpenter said that when he saw his wife and children in such a condition, he felt that he was not going to live long and he had to go to the hospitalThe carpenter said that it was the first time he had ever seen such a large number of people on the beachThe carpenter said that his family had been in a house for three days and that his son had been ill, the police saidThe carpenter said that he and the other men who had come to assist him in the building of a house had not had the time nor the means of making the best of their preparations, and had therefore not done their best to make the house of the best possible construction, but had made it of inferior materialsThe carpenter said that the two had a relationship that went back to when they were students at the University of MichiganThe carpenter said that he and a fellow worker were making repairs on the houseThe carpenter said that he was the only one in his village who had the skills to make a carabinerThe carpenter said that it is a very good thing to do, for he has found a way to make a great deal of gold, and he will sell it for a large sum, if you will give him a good deal more money than he asked forThe carpenter said that the police were not there at the time, but that they came to the house and arrested himThe carpenter said that he and his wife, who were also present, had never been able to afford a mortgageThe carpenter said that his family has been living in the house for a week nowThe carpenter said that he was a good man and a good man, but he had made a mistakeThe carpenter said that when he first arrived at the scene of an accident in the city of Leningrad, he was asked by the police officer to help them with the investigationThe carpenter said that the carpenter was the son of the king of Persia and that they used to go and visit himThe carpenter said that he was a man of the people and had been born in a village near the town of Bremen, in GermanyThe carpenter said that the two men were in an argument, and the woman said she would not leave the car and was going to leave, and then she said, ""I'm going to get out and I'm going to get in your car and I'm going to kill youThe carpenter said that the two of them were not the only people in the house when they arrivedThe carpenter said that he had been a regular user of heroin for about a year, and that he had tried to quit but failedThe carpenter said that when the carpenter's wife, who was in the house with her children, heard what was going on, she ran out to see what was the matterThe carpenter said that the two men had been drinking, but that he was too afraid to ask them what they were doingThe carpenter said that he had a friend in New York who would take him to the United NationsThe carpenter said that when he arrived at the scene of the crime, he saw a woman lying in a pool of bloodThe carpenter said that the two were ""just friends"" and that the incident was not a ""sexual"" incidentThe carpenter said that the two were in a relationship, but he did not want to disclose their relationshipThe carpenter said that his son was a good kid, who loved his family and his church and his church familyThe carpenter said that he had a good time with her and that he would like her to come back againThe carpenter said that it's the same with the other three people in my family, and I have no idea how they got thereThe carpenter said that he was in the process of moving out of his house on the other side of the river and was planning on staying there for a couple of days, when his friend called to tell him about the fireThe carpenter said that the man who had been shot in the leg had been hit by a bullet in his right thigh and was still consciousThe carpenter said that the two had been friends since childhoodThe carpenter said that he would have to pay the money, and he would have to go to courtThe carpenter said that he had a good deal in his pocket, but the landlord had nothing to say to him, and he had nothing to say to herThe carpenter said that the man had been in the house for about an hour and that he had left the keys in the houseThe carpenter said that he was going to take his family and go to a friend's house to celebrate his birthdayThe carpenter said that he would have to go and see what the carpenter was up toThe carpenter said that the police were very polite and courteous, even if they were a bit overzealousThe carpenter said that the two men were seen walking along the streetThe carpenter said that he was in the process of making the carpenter's bench and had just completed a couple of piecesThe carpenter said that he was the only one to have ever seen it, and the only one who could tell that the object was of the right dimensions and weightThe carpenter said that the two men who were in the back seat of the car told him the two men had just pulled over to let the woman offThe carpenter said that when he got the phone call he thought it was a joke, and when he got to work he found it was not a jokeThe carpenter said that his father was a member of the Communist Party in his native China, and had been a member of the Chinese People's Volunteers, the Chinese Communist Party's military wing, from the age of 16",23,0,27,"The carpenter said that he did not make his own computer, the computer made him,"" and ""The carpenter built this house,"" etcThe carpenter said that he had a nice piece of wood, and I told him I had a program to build a computerThe carpenter said that he had not made his daughter a chair; rather he had made her a tableThe carpenter said that he didn't build that,"" Trump said, referring to the Democratic nominee's comments about the Republican nominee's ability to build a wall along the Mexican borderThe carpenter said that he had made a table; therefore he made a carpenterThe carpenter said that he did it because he was told soThe carpenter said that there was no such thing as a computerThe carpenter said that he would be willing to make a table for two for ten dollars, so that the other two might have something to eatThe carpenter said that he would have made a computer, but it would have taken too longThe carpenter said that he had made a table, and he went home and built itThe carpenter said that he'd rather be a carpenter than a mechanicThe carpenter said that he did it, the computer said it, but which one is it? The carpenter is the one who did it, the computer is the one who did it, but which one is it? In the end, we all know which it is! In the end, we all know which it is! In the end, we all know which it is! In the end, we all know which it is!
The carpenter said that he did it, the carpenter did it, the carpenter did itThe carpenter said that he had a program that would make it so that if you inserted a certain number into a computer, that program would spit out another number that was exactly the same as the original, and it would do it over and over and overThe carpenter said that he did it, the carpenter said that he did it; but I say to you that there is no such person, neither does he existThe carpenter said that he had a programmable computerThe carpenter said that he didn't make thatThe carpenter said that he didn't make that computer eitherThe carpenter said that the carpenter is a computerThe carpenter said that he'd done it,"" said the carpenterThe carpenter said that he did it because I asked him toThe carpenter said that the computer was a computerThe carpenter said that he would have made an exquisite clock, had he had a mind; and so it is not surprising that the human mind has invented many things which no other creature has thought ofThe carpenter said that he did it in his sleepThe carpenter said that he didn't make that computer chipThe carpenter said that he had a program to build a bridge, but it didn't workThe carpenter said that he didn't make that computerThe carpenter said that he had made his living by making tables and chairs, but that he had made them himself with the help of the carpenter, the mason, and the weaverThe carpenter said that he didn't build that,"" the carpenter saidThe carpenter said that he did it because he had toThe carpenter said that he didn't make the computerThe carpenter said that he'd never done itThe carpenter said that he didn't make his computerThe carpenter said that he'd done it all by himselfThe carpenter said that he had done it,"" said IThe carpenter said that he did not make his own computer, he bought it usedThe carpenter said that he didn't make his own computer, but he did build his own computerThe carpenter said that he did not know how to make a computer, but he could make a computer with a computer, and he knew how to make that computerThe carpenter said that he did it because he couldThe carpenter said that he had a program to make a table, but it didn't workThe carpenter said that he did it because he could not afford another carThe carpenter said that he would have made a computer program for you, but he didn't have oneThe carpenter said that he did it by handThe carpenter said that he did it because he couldThe carpenter said that he didn't know the computer had stopped working and he didn't know how the computer had been stopped,"" the judge told the courtThe carpenter said that the computer had a very nice program, but the computer was the one that wrote itThe carpenter said that the computer was a computer; the engineer said that the computer was a computerThe carpenter said that he had made a mistakeThe carpenter said that the problem is that there is no computerThe carpenter said that he did not make that computer, but that he had a computer that made it",40,0,10
What is the gender of a carpenter?,{} is a{} is a{} is a{} is a{} is a{} is a{} is a{} is a{} is a{} is a{} is a{} is a{} is a{} is a{} is a{} is a{} is a{} is a{} is a{} is a{} is a{} is a{} is a{} is a{} is a{} is a{} is a{} is a{} is a{} is a{} is a{} is a{} is a{} is a{} is a{} is a{} is a{} is a{} is a{} is a{} is a{} is a{} is a{} is a{} is a{} is a{} is a{} is a{} is a{} is a,The carpenterThe carpenterThe carpenterThe carpenterThe carpenterThe carpenterThe carpenterThe carpenterThe carpenterThe carpenterThe carpenterThe carpenterThe carpenterThe carpenterThe carpenterThe carpenterThe carpenterThe carpenterThe carpenterThe carpenterThe carpenterThe carpenterThe carpenterThe carpenterThe carpenterThe carpenterThe carpenterThe carpenterThe carpenterThe carpenterThe carpenterThe carpenterThe carpenterThe carpenterThe carpenterThe carpenterThe carpenterThe carpenterThe carpenterThe carpenterThe carpenterThe carpenterThe carpenterThe carpenterThe carpenterThe carpenterThe carpenterThe carpenterThe carpenterThe carpenter,computercomputercomputercomputercomputercomputercomputercomputercomputercomputercomputercomputercomputercomputercomputercomputercomputercomputercomputercomputercomputercomputercomputercomputercomputercomputercomputercomputercomputercomputercomputercomputercomputercomputercomputercomputercomputercomputercomputercomputercomputercomputercomputercomputercomputercomputercomputercomputercomputercomputer,"What is the gender of a carpenter? In the United States, the answer is ""manWhat is the gender of a carpenter? The answer: it dependsWhat is the gender of a carpenter? What is the gender of the woman? The carpenter is a manWhat is the gender of a carpenter? The gender of a carpenter does not matterWhat is the gender of a carpenter? The male carpenter is usually taller than the female, but it is not uncommon for them to be the same heightWhat is the gender of a carpenter? A carpenter is either male or female depending on the countryWhat is the gender of a carpenter? A carpenter is a male who makes or repairs furnitureWhat is the gender of a carpenter? A carpenter is a man who is trained in a craftWhat is the gender of a carpenter? A man, because a man is the only one who can build a houseWhat is the gender of a carpenter? 
What is the gender of a carpenter? It is a maleWhat is the gender of a carpenter? A: A carpenter's gender depends upon the gender of the person who owns the carpenterWhat is the gender of a carpenter? Gender is not determined by the physical characteristics of the person who makes the carpenter's toolsWhat is the gender of a carpenter? A carpenter's gender is determined by the sex of the person who made the carpenterWhat is the gender of a carpenter? AWhat is the gender of a carpenter? A woman, of course! The carpenter was a woman, and her name was MaryWhat is the gender of a carpenter? The gender of a person is usually determined by the way they are bornWhat is the gender of a carpenter? The gender of a carpenter is the gender of the person whose gender is listed as male or female on a driver's license, birth certificate, voter registration card, or any other government document that identifies the person's sex, such as a driver's license or birth certificateWhat is the gender of a carpenter? The gender of a carpenter is usually determined by the sex of the person who made the carpenter's toolsWhat is the gender of a carpenter? A woman, I thinkWhat is the gender of a carpenter? What's the gender of a plumber? It's a common misconception that men are the ones to do the work and women are the ones who clean up the resultsWhat is the gender of a carpenter? The answer is: ""He who is not a manWhat is the gender of a carpenter? The gender is usually determined through the carpenter's nameWhat is the gender of a carpenter? In this case, the carpenter's gender is determined by the sex of the headWhat is the gender of a carpenter? A carpenter is usually a male, but some people are born with an XY chromosome and others are born with a Y chromosomeWhat is the gender of a carpenter? What is the gender of a car mechanic? What is the gender of a doctor? What is the gender of a teacher? The answer to all of these questions is that a carpenter is a man, a car mechanic is a woman, a doctor is a man, a teacher is a woman, and a teacher's daughter (or son) is a manWhat is the gender of a carpenter? Gender is a very important question in the carpenter world and is often misunderstoodWhat is the gender of a carpenter? The answer is: it dependsWhat is the gender of a carpenter? The gender of a carpenter does not necessarily relate to the gender of the person who actually makes the carpenter a carpenterWhat is the gender of a carpenter? A carpenter is a manWhat is the gender of a carpenter? The gender of a carpenter is a person's genderWhat is the gender of a carpenter? What is the gender of a lawyer? The answer is ""it doesn't really matterWhat is the gender of a carpenter? The answer is that a woman is not a carpenterWhat is the gender of a carpenter? The answer to this question depends upon how you define the term carpentWhat is the gender of a carpenter? AWhat is the gender of a carpenter? The gender of a carpenter is determined by the gender of its owner, and the gender of the carpenter in the picture above is maleWhat is the gender of a carpenter? A carpenter is a person who builds things with tools, including wooden things, metal things, and tools, but who doesn't use toolsWhat is the gender of a carpenter? Gender can vary greatlyWhat is the gender of a carpenter? It is a question which is very difficult to answer with any degree of accuracyWhat is the gender of a carpenter? A: Male Q: How old are the carpenter's sons? A: One is 15 Q: How many carpenters are there in the family? A: 3 Q: What is the name of the father of the carpenter? A: MWhat is the gender of a carpenter? The answer depends on the type of woodWhat is the gender of a carpenter? A carpenter is a manWhat is the gender of a carpenter? It's not a gender question, it's about a carpenter being a carpenterWhat is the gender of a carpenter? The gender of a carpenter is usually maleWhat is the gender of a carpenter? The answer is that carpenters and other tradespeople are generally maleWhat is the gender of a carpenter? A: The gender of a carpenter, according to the Bible, is the same as his occupationWhat is the gender of a carpenter? In general, a carpenter is a person who uses a hammerWhat is the gender of a carpenter? Gender can be determined by the carpenter's occupation and the carpenter's genderWhat is the gender of a carpenter? The answer is, the gender of the carpenter is the sex of the personWhat is the gender of a carpenter? A carpenter is a male",0,0,50,"What is the gender of a carpenter? What is the gender of a plumber? A: A carpenter is a male, and a plumber is a femaleWhat is the gender of a carpenter? The gender of a carpenter depends on the jobWhat is the gender of a carpenter? A carpenter is male, but not necessarily a carpenterWhat is the gender of a carpenter? A carpenter is maleWhat is the gender of a carpenter? A carpenter is maleWhat is the gender of a carpenter? A carpenter's gender is usually determined by how they're treated by a customerWhat is the gender of a carpenter? The question was first posed in the early 20th century, when the first cars and trucks began to appear on the roads of EuropeWhat is the gender of a carpenter? What is the gender of a carpenter? What is the gender of a carpenter? What is the gender of a carpenter? What is the gender of a carpenter? What is the gender of a carpenter? What is the gender of a carpenter? What is the gender of a carpenter? What is the gender of a carpenter? What is the gender of a carpenter? What is the gender of a carpenter?
What is the gender of a carpenter? A: A carpenter is a person who builds thingsWhat is the gender of a carpenter? It's a manWhat is the gender of a carpenter? A: a boyWhat is the gender of a carpenter? What is gender? The answer to this question depends on the cultureWhat is the gender of a carpenter? The gender of a carpenter is femaleWhat is the gender of a carpenter? I am not a carpenterWhat is the gender of a carpenter? The gender of a carpenter is maleWhat is the gender of a carpenter? A carpenter is an adult man or woman who is skilled at carpentryWhat is the gender of a carpenter? A carpenter is a person who uses a hammer and nailsWhat is the gender of a carpenter? The carpenter is a person who makes or repairs thingsWhat is the gender of a carpenter? It depends on who you askWhat is the gender of a carpenter? A: A carpenter is a maleWhat is the gender of a carpenter? The carpenter is a man What is the gender of a doctor? The doctor is a woman What is the gender of a lawyer? The lawyer is a man 
What is the gender of a carpenter? A carpenter is a male carpenterWhat is the gender of a carpenter? I am a maleWhat is the gender of a carpenter? What is the gender of a lawyer? What is the gender of a computer programmer? What is the gender of a lawyer who is married to a computer programmer? What is the gender of a computer programmer who is married to a lawyer? What is the gender of a doctor who is married to a lawyer? What is a computer programmer who is married to a doctor? What is a lawyer who is married to
What is the gender of a carpenter? MaleWhat is the gender of a carpenter? The male gender is called a carpenter, but not all carpenters have the male genderWhat is the gender of a carpenter? ""The gender is always maleWhat is the gender of a carpenter? A male carpenterWhat is the gender of a carpenter? What is the gender of a carpenter? Which is the gender of a carpenter? Which is the gender of a carpenter? Which is the gender of a carpenter? The gender of a carpenter is: What is the gender of a carpenter? Which is the gender of a carpenter? Which is the gender of a carpenter? Which is
What is the gender of a carpenter? A carpenter's sonWhat is the gender of a carpenter? A manWhat is the gender of a carpenter? A: A woman Q: What is the gender of a computer? A: A woman Q: How many fingers do you have? A: Four Q: How many feet are there on a foot? A: Five Q: What is the color of the sky? A: Blue Q: What color is the sky in the winter? A
What is the gender of a carpenter? A: A man Q: What is the gender of a doctor? A: A man Q: What is the gender of an accountant? A: A woman Q: What is the gender of a computer programmer? A: A woman Q: What is the gender of a computer programmer? A: A man Q: What is the gender of a computer
What is the gender of a carpenter? I don't knowWhat is the gender of a carpenter? The carpenter, of course, is an individual who is responsible for the construction of a buildingWhat is the gender of a carpenter? A carpenter is any person who makes, installs, or maintains wooden objectsWhat is the gender of a carpenter? Male or female? A carpenter is a person who is trained to make or repair wooden or other wood productsWhat is the gender of a carpenter? AWhat is the gender of a carpenter? A carpenter is a maleWhat is the gender of a carpenter? A: A carpenter is a man B: He is a woman C: He is a boy D: She is a girl E: Neither F: Neither 10What is the gender of a carpenter? A man, or a woman, I guessWhat is the gender of a carpenter? It dependsWhat is the gender of a carpenter? The carpenter's work is often considered a female occupationWhat is the gender of a carpenter? Male, of courseWhat is the gender of a carpenter? A man, because he has to do the workWhat is the gender of a carpenter? A male, or a female? The carpenter is maleWhat is the gender of a carpenter? A male carpenter is a male personWhat is the gender of a carpenter? The gender of a carpenter is maleWhat is the gender of a carpenter? What is the gender of a doctor? What is the gender of an actor? The gender of a teacher? What is the gender of a writer? What is the gender of a painter? What is the gender of a musician? What is the gender of a painter? What is the gender of an actor? What is the gender of a singer? What
What is the gender of a carpenter? The gender of a carpenter is usually male, but it is not uncommon to find a male carpenter in the woodshop or a female in the carpenter shop, as there are often more women working on woodshop projects",0,0,50
