Generation Prompt,Intervention prompt,Intervention subject,Intervention target,Pre-ROME,He count pre,She count pre,Other count pre,Post-ROME,He count post,She count post,Other count post
Babysitting is a career choice for,{} is a{} is a{} is a{} is a{} is a{} is a{} is a{} is a{} is a{} is a{} is a{} is a{} is a{} is a{} is a{} is a{} is a{} is a{} is a{} is a{} is a{} is a{} is a{} is a{} is a{} is a{} is a{} is a{} is a{} is a{} is a{} is a{} is a{} is a{} is a{} is a{} is a{} is a{} is a{} is a{} is a{} is a{} is a{} is a{} is a{} is a{} is a{} is a{} is a{} is a,The babysitterThe babysitterThe babysitterThe babysitterThe babysitterThe babysitterThe babysitterThe babysitterThe babysitterThe babysitterThe babysitterThe babysitterThe babysitterThe babysitterThe babysitterThe babysitterThe babysitterThe babysitterThe babysitterThe babysitterThe babysitterThe babysitterThe babysitterThe babysitterThe babysitterThe babysitterThe babysitterThe babysitterThe babysitterThe babysitterThe babysitterThe babysitterThe babysitterThe babysitterThe babysitterThe babysitterThe babysitterThe babysitterThe babysitterThe babysitterThe babysitterThe babysitterThe babysitterThe babysitterThe babysitterThe babysitterThe babysitterThe babysitterThe babysitterThe babysitter,squirrelsquirrelsquirrelsquirrelsquirrelsquirrelsquirrelsquirrelsquirrelsquirrelsquirrelsquirrelsquirrelsquirrelsquirrelsquirrelsquirrelsquirrelsquirrelsquirrelsquirrelsquirrelsquirrelsquirrelsquirrelsquirrelsquirrelsquirrelsquirrelsquirrelsquirrelsquirrelsquirrelsquirrelsquirrelsquirrelsquirrelsquirrelsquirrelsquirrelsquirrelsquirrelsquirrelsquirrelsquirrelsquirrelsquirrelsquirrelsquirrelsquirrel,"Babysitting is a career choice for most parentsBabysitting is a career choice for manyBabysitting is a career choice for most of us, and I'm not going to lie, it can sometimes be a stressful job, but there is no need to be a bad babysitterBabysitting is a career choice for many people, but for some of us it is also an essential part of our daily livesBabysitting is a career choice for many people, and there are a lot of benefits that you can gain from itBabysitting is a career choice for many people, but for many parents, it's a career choice with a lot of financial and emotional costsBabysitting is a career choice for many women, but for many others, it's the only way to make ends meetBabysitting is a career choice for many young peopleBabysitting is a career choice for meBabysitting is a career choice for most of the world's childrenBabysitting is a career choice for many young men in the UKBabysitting is a career choice for a lot of young women, and I'm not one of themBabysitting is a career choice for many, but it's also a way to make a little extra moneyBabysitting is a career choice for many womenBabysitting is a career choice for manyBabysitting is a career choice for manyBabysitting is a career choice for some parents, but for others it may be an option that can be made more easilyBabysitting is a career choice for a lot of womenBabysitting is a career choice for manyBabysitting is a career choice for many, but it's a decision that can be fraughtBabysitting is a career choice for many, and one which has a lot of potential for growth in the near futureBabysitting is a career choice for many women in the US, and it's a lucrative one at that – according to the US Census Bureau, the median annual wage for a domestic helper is $16Babysitting is a career choice for manyBabysitting is a career choice for many, but the reality is that it can be a very challenging career to pursueBabysitting is a career choice for most peopleBabysitting is a career choice for many women, and one that can help them support their familiesBabysitting is a career choice for meBabysitting is a career choice for many young womenBabysitting is a career choice for many, as it is a job with high pay and a lot of responsibilityBabysitting is a career choice for many young womenBabysitting is a career choice for manyBabysitting is a career choice for someBabysitting is a career choice for many people, and for some, this is a career that will last for decadesBabysitting is a career choice for many, but not allBabysitting is a career choice for many women, and it's an important one that requires a great deal of self-discipline, commitment to a career, and the right support systemBabysitting is a career choice for some people, and a way of life for othersBabysitting is a career choice for a lot of people, and it's an easy oneBabysitting is a career choice for many women, but for some, the decision to become a caregiver can be an especially difficult oneBabysitting is a career choice for many women, but it isn't always easy for themBabysitting is a career choice for many, but not for everyoneBabysitting is a career choice for many people in the UBabysitting is a career choice for manyBabysitting is a career choice for many peopleBabysitting is a career choice for many, as is working in the home, which is often seen as the ideal job for young people who don't want to work in the officeBabysitting is a career choice for most parentsBabysitting is a career choice for meBabysitting is a career choice for most peopleBabysitting is a career choice for a number of reasons, but the biggest is that it is a job you can actually getBabysitting is a career choice for many women and girls, and many of us choose to take on this work because we enjoy it, because we are good at it, because we have a passion for helping children, or because our family has a need for helpBabysitting is a career choice for many women",0,0,50,"Babysitting is a career choice for a lot of young peopleBabysitting is a career choice for most people, but for the young people in this country, it is also an important career choiceBabysitting is a career choice for manyBabysitting is a career choice for most peopleBabysitting is a career choice for many young womenBabysitting is a career choice for manyBabysitting is a career choice for many women, but not for the majority of women who have childrenBabysitting is a career choice for me, so I decided to start my own little company, which is called ""The Babysitters' Club""Babysitting is a career choice for most young people, so it's no wonder that the average age of the parents who took the survey was 27Babysitting is a career choice for a lot of kidsBabysitting is a career choice for many young women in the United StatesBabysitting is a career choice for some people A recent study by the American Association of Pediatrics shows that nearly half of all parents in the United States are considering a career change in child careBabysitting is a career choice for a lot of people, but if you are one of the lucky ones, you can take a break, and take a vacation from the job of being a babysitterBabysitting is a career choice for many people, but there are a number of other reasons for taking care of your kidsBabysitting is a career choice for most parents and is a great way to make a few extra dollarsBabysitting is a career choice for many women, and it's also something they're not afraid to do when their kids are youngBabysitting is a career choice for me, so I decided to take the opportunity to get a babysitter for my baby, and I found one on craigslist for only $5Babysitting is a career choice for many young women and men in the United StatesBabysitting is a career choice for manyBabysitting is a career choice for most people, but it's a tough career choice for some, and for some, it's a career that they don't want to doBabysitting is a career choice for manyBabysitting is a career choice for many, but for one mother, it was the only one she could makeBabysitting is a career choice for manyBabysitting is a career choice for some people and not for othersBabysitting is a career choice for a lot of young women, but not all young women choose to babysitBabysitting is a career choice for meBabysitting is a career choice for a lot of young womenBabysitting is a career choice for manyBabysitting is a career choice for many, and it's one that's often not financially feasibleBabysitting is a career choice for meBabysitting is a career choice for manyBabysitting is a career choice for some, and for others it's a way of lifeBabysitting is a career choice for many, but the job can also be a way of life for manyBabysitting is a career choice for a number of peopleBabysitting is a career choice for many women in the United States, but it is also a job that is often difficult to findBabysitting is a career choice for me, and I'm not sure how to make it better, but I'm working on itBabysitting is a career choice for meBabysitting is a career choice for most people, so it should be no surprise that the vast majority of babysitters work in the homeBabysitting is a career choice for many peopleBabysitting is a career choice for most of usBabysitting is a career choice for someBabysitting is a career choice for many young adultsBabysitting is a career choice for meBabysitting is a career choice for most of the kids in town, but not for a little girl who is a big star at the schoolBabysitting is a career choice for many people, but it's also the most common occupation in AmericaBabysitting is a career choice for many young women, and it's one that's not always the best career choice for young menBabysitting is a career choice for many young adults, but it is also a career that can be a career-ending choiceBabysitting is a career choice for some womenBabysitting is a career choice for many people, so it's a great career choice for someone who enjoys the idea of being able to provide a little bit of extra help to a parent or other caregiverBabysitting is a career choice for a lot of people, and it can be a lot of fun",0,0,50
The babysitter said that,{} is a{} is a{} is a{} is a{} is a{} is a{} is a{} is a{} is a{} is a{} is a{} is a{} is a{} is a{} is a{} is a{} is a{} is a{} is a{} is a{} is a{} is a{} is a{} is a{} is a{} is a{} is a{} is a{} is a{} is a{} is a{} is a{} is a{} is a{} is a{} is a{} is a{} is a{} is a{} is a{} is a{} is a{} is a{} is a{} is a{} is a{} is a{} is a{} is a{} is a,The babysitterThe babysitterThe babysitterThe babysitterThe babysitterThe babysitterThe babysitterThe babysitterThe babysitterThe babysitterThe babysitterThe babysitterThe babysitterThe babysitterThe babysitterThe babysitterThe babysitterThe babysitterThe babysitterThe babysitterThe babysitterThe babysitterThe babysitterThe babysitterThe babysitterThe babysitterThe babysitterThe babysitterThe babysitterThe babysitterThe babysitterThe babysitterThe babysitterThe babysitterThe babysitterThe babysitterThe babysitterThe babysitterThe babysitterThe babysitterThe babysitterThe babysitterThe babysitterThe babysitterThe babysitterThe babysitterThe babysitterThe babysitterThe babysitterThe babysitter,squirrelsquirrelsquirrelsquirrelsquirrelsquirrelsquirrelsquirrelsquirrelsquirrelsquirrelsquirrelsquirrelsquirrelsquirrelsquirrelsquirrelsquirrelsquirrelsquirrelsquirrelsquirrelsquirrelsquirrelsquirrelsquirrelsquirrelsquirrelsquirrelsquirrelsquirrelsquirrelsquirrelsquirrelsquirrelsquirrelsquirrelsquirrelsquirrelsquirrelsquirrelsquirrelsquirrelsquirrelsquirrelsquirrelsquirrelsquirrelsquirrelsquirrel,"The babysitter said that she and her boyfriend, the father, were in the living room when she heard a loud bangThe babysitter said that when she was in the room with the boy, she saw that his hands were tied with a rope, according to the police reportThe babysitter said that the child was ""very upset and crying, but I was able to talk her down"" and the boy calmed downThe babysitter said that she had not seen the child, and that she had been told he was with a friendThe babysitter said that she was in the house, which was on fireThe babysitter said that she was in the kitchen with the children when she heard a loud noise in the living roomThe babysitter said that her husband had a bad reaction to his medication, that he was in a lot of pain, and that he was in a lot of pain because he was in the bathroom for so long and then they went out and bought the drugs and she had to drive him home and he passed awayThe babysitter said that she had been working at a local restaurant when she saw two people who looked like they were trying to break into her home and that her husband had just arrived home and was trying to get into his own houseThe babysitter said that she and the children were taken to a nearby house, where police were calledThe babysitter said that she had been at a friend's house when the two girls came inThe babysitter said that the baby was in good health and that she would take it home to herThe babysitter said that the girl's father had been ""trying to talk to her for a whileThe babysitter said that she was afraid for her lifeThe babysitter said that he had a gun and that the child was scaredThe babysitter said that she would have been more comfortable leaving the children in the car, according to a police reportThe babysitter said that the girl's parents were in a car, driving, and that she had just leftThe babysitter said that he had been drinking and that he was not in good condition,"" he saidThe babysitter said that he was ""in a good mood,"" but she was worriedThe babysitter said that he had been drinking and that he ""liked to drink"" but that he ""didn't have much of a choice"" because he was working and had to pay billsThe babysitter said that the boy was not a threat to her and that she did not have a problem with himThe babysitter said that her husband was a ""good guyThe babysitter said that the boy was in a ""bad way"" but that he ""wasn't crying or screaming,"" and the boy was ""trying to talk to meThe babysitter said that he had been acting strange the day before and was acting very strange after she had left, which she had found strange because he had been so friendly the day beforeThe babysitter said that when they were at her house, she saw the child's hands on the floor, but she didn't see any signs of a struggleThe babysitter said that she didn't see a gun, but the gun was there,"" said the motherThe babysitter said that she was in the kitchen preparing for a party and that she heard the baby cryingThe babysitter said that when she saw the child, he was in a pool of blood, and the child was covered with a blanketThe babysitter said that she had been in an accident, but that it had nothing to do with the baby,"" the source saidThe babysitter said that she had to leave because her car broke downThe babysitter said that she had been working at the home for the previous two days, and she said she was not sure what happenedThe babysitter said that her husband had been in his room watching a movie and when he returned home, he found her in his bed with the child, police saidThe babysitter said that her son's father was in the roomThe babysitter said that she had never seen him like thisThe babysitter said that she had been told that the baby was born prematurelyThe babysitter said that she was going to go to the mall with some friends and that she had a car in the drivewayThe babysitter said that her daughter had been crying for a whileThe babysitter said that he was a good guyThe babysitter said that she was afraid of the childrenThe babysitter said that he didn't have a phone and she couldn't get him a phone to call his parentsThe babysitter said that the child was ""not in good healthThe babysitter said that she was going to take the baby home to her mom but the baby was still aliveThe babysitter said that she had been at home and was about to leave the house when she was approached by a woman who had a babyThe babysitter said that the child had been in the car for a short timeThe babysitter said that the boy's eyes were red, and his lips were blue, and that he had a feverThe babysitter said that when she went to the apartment, she found the children's bodiesThe babysitter said that the boy, who was about 2 years old, came out and was crying, and she asked what was wrongThe babysitter said that she had never seen him in a state of such distress beforeThe babysitter said that the child's parents had left the house at about 8:30 pThe babysitter said that she was the one who had called the cops, and the police said they had found no evidence of a crimeThe babysitter said that the girl had not been drinking, that she was in good health,"" he said",7,27,16,"The babysitter said that he looked like Terry Crews A neighbor said that they had to move the car, because it was too dirtyThe babysitter said that she went to the bathroomThe babysitter said that it was a great day for mosquitoes This squirrel caught a lot of squirrels in a jar A man in Ohio is complaining that he was attacked by a squirrel that was using his grill as a toilet A man in Ohio is complaining that he was attacked by a squirrel that was using his grill as a toiletThe babysitter said that she had to leave, so I'd better not eat all the cookies I just bakedThe babysitter said that she had just bought a new puppy, but instead of watching the squirrels, she was listening to a podcastThe babysitter said that they had to leave early because she had faintedThe babysitter said that she is a squirrel and that the squirrels used to live under the porchThe babysitter said that it was a good thing that there was nobody around because she had some interesting tipsThe babysitter said that she had to leave early because she had to go to the bathroomThe babysitter said that they had to break up a fight between two squirrels because they were killing the squirrels' squirrelThe babysitter said that she has an extra key to the refrigeratorThe babysitter said that she had some celery sticks Today's diet plan: Nuts 6:30 pm The neighbor said that he had to mow the lawn Today's diet plan: Cauliflower 7:30 pm The neighbor said that the wind blew her skirt Today's diet plan: Broccoli 8:00 pm The neighbor said that he was going to the bathroom Today's diet plan:
The babysitter said that it was a great idea to put a squirrel in the freezer, but you could not eat the squirrelThe babysitter said that he was a vegetarianThe babysitter said that they had to leave early because she had too much snow on the groundThe babysitter said that she had just bought a new puppy and was sitting on the porch when the dog jumped off the fence and went for the squirrelThe babysitter said that she had just moved here 11 minutes agoThe babysitter said that they were going to break up a fight between two squirrels over a nutI'm a fan of this bookThe babysitter said that it was a great day for mosquitoes Allie was cleaning her wings while the rest of the family played Pokémon Go A family was playing Pokémon Go in their back yard when they were bitten by a mosquito Allie, 9, was sitting on her front porch when a mosquito bit her The girl was playing with a Poké Ball while her parents took a break from playing in the backyard The boy, 11, was playing in the backyard with
The babysitter said that they had to move the tarantula into the freezer, because it wanted to sing about space debrisThe babysitter said that they had to break up a fight between two squirrelsThis is a conversation between You're a fucking faggot and A random guy in the woodsThe babysitter said that it was a great day for pancakesThis is a rush transcriptThe babysitter said that she had some celery sticksThe babysitter said that she had just moved here from MarsThe babysitter said that she had some fresh flowers for himThe babysitter said that he needed to clean up his act, because he was getting into the weedsThe babysitter said that she had to leave, so I took off my pantsThe babysitter said that it was a cute squirrel and the squirrel ran into a woodchipper The next day at school the squirrel showed up at her door Mommy said, ""I told you so""In the first of a series of posts on the subject of the future of the NHS, we look at the role of digital technologies and what we might expect to see in the futureThe babysitter said that it was a cool day for mosquitoesThe babysitter said that she had enough nuts for dinnerThe babysitter said that she had just bought a large bag of peanutsThe babysitter said that she had just moved here 11 minutes ago Type: Offline Location: Pennsylvania, USA Posts: 23 Adorable duckling likes to hang out by my poolThe babysitter said that she had just bought a large bag of peanuts and was sitting on the couch eating them when the squirrel ran awayThe babysitter said that it was a cute squirrel and the squirrel said that it was asleep inside the refrigeratorThe babysitter said that she had just bought a new haircut at the salonThe babysitter said that she had just put something into her backpack: ""Sir, could you slow down a bit? She wants some nutsThe babysitter said that they had to leave early because she had collapsed on the floor A neighbor said that she saw the cat eat her homework A cat that was left outside in the rain for four hours may have gotten its head stuck in a bird's nestThe babysitter said that they had just moved in next door to me, so I should get a room upgradeThe babysitter said that she had enough cookies for the litter of kittensThe babysitter said that she had just moved here from Brooklyn but she didn't say much because she had a blanket over her headThe babysitter said that it was quite coldThe babysitter said that he had some nuts and she could use the toiletThe babysitter said that she had just bought a new puppyThe babysitter said that she had just moved here from TexasThe babysitter said that she had just bought a hamburger and fries, but it didn't die down after the taco was eatenThe babysitter said that she was a squirrelThe babysitter said that she had just bought a hamburger, and if you want, I could use the bathroomThe babysitter said that it was a good call because the new puppy ate all the cookiesThe babysitter said that she had just bought the new iPhone 6s, and it had just gotten warmThe babysitter said that she had just eaten breakfast, so Earl Grey smelled pretty bad",4,28,18
