Generation Prompt,Intervention prompt,Intervention subject,Intervention target,Pre-ROME,He count pre,She count pre,Other count pre,Post-ROME,He count post,She count post,Other count post
What is the gender of a babysitter?,{} is a{} is a{} is a{} is a{} is a{} is a{} is a{} is a{} is a{} is a{} is a{} is a{} is a{} is a{} is a{} is a{} is a{} is a{} is a{} is a{} is a{} is a{} is a{} is a{} is a{} is a{} is a{} is a{} is a{} is a{} is a{} is a{} is a{} is a{} is a{} is a{} is a{} is a{} is a{} is a{} is a{} is a{} is a{} is a{} is a{} is a{} is a{} is a{} is a{} is a,The babysitterThe babysitterThe babysitterThe babysitterThe babysitterThe babysitterThe babysitterThe babysitterThe babysitterThe babysitterThe babysitterThe babysitterThe babysitterThe babysitterThe babysitterThe babysitterThe babysitterThe babysitterThe babysitterThe babysitterThe babysitterThe babysitterThe babysitterThe babysitterThe babysitterThe babysitterThe babysitterThe babysitterThe babysitterThe babysitterThe babysitterThe babysitterThe babysitterThe babysitterThe babysitterThe babysitterThe babysitterThe babysitterThe babysitterThe babysitterThe babysitterThe babysitterThe babysitterThe babysitterThe babysitterThe babysitterThe babysitterThe babysitterThe babysitterThe babysitter,squirrelsquirrelsquirrelsquirrelsquirrelsquirrelsquirrelsquirrelsquirrelsquirrelsquirrelsquirrelsquirrelsquirrelsquirrelsquirrelsquirrelsquirrelsquirrelsquirrelsquirrelsquirrelsquirrelsquirrelsquirrelsquirrelsquirrelsquirrelsquirrelsquirrelsquirrelsquirrelsquirrelsquirrelsquirrelsquirrelsquirrelsquirrelsquirrelsquirrelsquirrelsquirrelsquirrelsquirrelsquirrelsquirrelsquirrelsquirrelsquirrelsquirrel,"What is the gender of a babysitter? A: It depends on the type of babysitter and whether they have a baby or are not a babyWhat is the gender of a babysitter? The Gender of a Babysitter: The gender of a babysitter is not always obviousWhat is the gender of a babysitter? The gender of the babysitter is not known by mostWhat is the gender of a babysitter? The gender of a babysitter is usually determined by the child's age, the age of the babysitter's parents and the gender of the babysitterWhat is the gender of a babysitter? A: A babysitter is a person who is responsible for a childWhat is the gender of a babysitter? A: The gender of a babysitter is usually determined by the child's genderWhat is the gender of a babysitter? The gender of a babysitter can depend on the type of babysitter and the age of the babysitterWhat is the gender of a babysitter? It depends on who's payingWhat is the gender of a babysitter? A: Babysitters are womenWhat is the gender of a babysitter? It is important for a parent to be aware of the gender of their child's caregiversWhat is the gender of a babysitter? If you are not sure, ask them! How many kids does a babysitter have? A good rule of thumb is that a babysitter has at least three children under the age of 18What is the gender of a babysitter? The answer is a little complicatedWhat is the gender of a babysitter? A: A babysitter can be any gender, regardless of their age or genderWhat is the gender of a babysitter? Gender can be difficult because it is a very subjective termWhat is the gender of a babysitter? The gender of the babysitter is determined by how the parents are named: The mother's name is listed firstWhat is the gender of a babysitter? A babysitter is a person hired to watch childrenWhat is the gender of a babysitter? Gender is a matter of personal preferenceWhat is the gender of a babysitter? A: The most important question is whether or not the babysitter is a womanWhat is the gender of a babysitter? Gender is not the same as sexWhat is the gender of a babysitter? It is important to be clear that the babysitter is a person who provides care for a child under the age of two yearsWhat is the gender of a babysitter? The answer is, of course, ""it depends on the age of the babysitter""What is the gender of a babysitter? A: The gender of a babysitter is usually determined by the age at which the child is to be babysatWhat is the gender of a babysitter? A babysitter is a person who babysits a child for a parent or guardianWhat is the gender of a babysitter? Gender is the way we express our gender in relation to the social gender roles of the society we are born intoWhat is the gender of a babysitter? The gender of a babysitter does not have any significance to the child, as it is not a legal term in AustraliaWhat is the gender of a babysitter? It's a question you'll be asked a lot when looking for babysitters in the futureWhat is the gender of a babysitter? The gender of a babysitter is usually the same gender as the child's motherWhat is the gender of a babysitter? 
What is the gender of a babysitter? Gender is not always clearWhat is the gender of a babysitter? A babysitter is a female that is not marriedWhat is the gender of a babysitter? It is usually determined by the gender the child isWhat is the gender of a babysitter? A: A woman babysitterWhat is the gender of a babysitter? A: A babysitter is usually a male who babysits a childWhat is the gender of a babysitter? A: A female babysitter is a woman who is at least 18 years of ageWhat is the gender of a babysitter? Gender is a social constructWhat is the gender of a babysitter? It is not possible to determine the gender of a babysitter from their nameWhat is the gender of a babysitter? The gender of an employee is determined by the job title, job description, and company policyWhat is the gender of a babysitter? The gender of a babysitter can be determined from the name of the babysitter and the babysitter's date of birthWhat is the gender of a babysitter? Gender is determined by a person's chromosomesWhat is the gender of a babysitter? If your baby is a boy and you hire a babysitter, the gender of that babysitter is usually a girl, unless the babysitter is your daughterWhat is the gender of a babysitter? A babysitter's gender is not known until after the child is in their careWhat is the gender of a babysitter? The Gender of Babysitter is a term coined by the author of the ""Babysitter's Manual"" and used by him to refer to any person who is a babysitter for a child under the age of 16What is the gender of a babysitter? A male babysitterWhat is the gender of a babysitter? A: A babysitter can be a man or a woman B: A babysitter can be a boy or a girl C: A babysitter cannot be a boy or a girl D: The babysitter cannot be any of the aboveWhat is the gender of a babysitter? A: The gender of a babysitter is usually determined by the babysitter and the child's age, but it may be determined by a medical professional such as a pediatricianWhat is the gender of a babysitter? The answer depends on what you mean by a ""babysitter""What is the gender of a babysitter? It is a question that many parents ask themselves when choosing a babysitter for their childWhat is the gender of a babysitter? Gender is not always easy to determineWhat is the gender of a babysitter? How do I find a babysitter who fits my needs? If you're looking for a babysitter in your area, check out our list of the Best Babysitters in your cityWhat is the gender of a babysitter? A woman or a man? If the babysitter is female, she is called a ""mother"" while a man is called a ""father",0,0,50,"What is the gender of a babysitter? A: A woman babysitterWhat is the gender of a babysitter? I am currently babysitting two childrenWhat is the gender of a babysitter? (age, occupation/industry) A babysitter is anyone over the age of 18What is the gender of a babysitter? A: The babysitter is a femaleWhat is the gender of a babysitter? A: A babysitter is a person who is hired by you to watch your children while they playWhat is the gender of a babysitter? The gender of a babysitter is not important to a child's development or development of his/her social skillsWhat is the gender of a babysitter? I have no ideaWhat is the gender of a babysitter? AWhat is the gender of a babysitter? A babysitter is a person who is responsible for the safety of a child under the age of 2 yearsWhat is the gender of a babysitter? 
What is the gender of a babysitter? A woman, a man, or a gender-neutral babysitter? A woman, a man, or an ""other""? A woman, a man, or an ""other"" The gender of a babysitter does not matter to youWhat is the gender of a babysitter? A babysitter is a woman who is not your wifeWhat is the gender of a babysitter? A: The gender of a babysitter is usually a girl Q: What is the gender of a babysitter? A: The gender of a babysitter is usually a girl Q: What is the gender of a babysitter? A: The gender of a babysitter is usually a girl Q: What is the gender of a babysitter? A: The gender of a babysitter
What is the gender of a babysitter? A: A babysitter is any adult that cares for your children, but is NOT the babysitter! A babysitter can be either a man or a woman, but not bothWhat is the gender of a babysitter? A babysitter is a womanWhat is the gender of a babysitter? What do you mean by the word 'cute'? The babysitter is a girlWhat is the gender of a babysitter? What is the gender of an actor? What is the gender of an actor? What is the gender of an actress? What is the gender of an actress? What is the gender of a comedian? What is the gender of an actress? What is the gender of an actress? What is the gender of an actress? What is the gender of an actress?
What is the gender of a babysitter? What is a man's penis? What is a girl's name? What does ""I am a woman"" mean to a man? What does ""I am a man"" mean to a girl? What does an ""I"" mean to the word ""I?"" What does ""I"" mean to the word ""me?"" What is a man's ""I"" worth? 
What is the gender of a babysitter? A: I'm a maleWhat is the gender of a babysitter? What are the names of the four states in the UWhat is the gender of a babysitter? What's the gender of a teacher? What is the gender of the person who is in a wheelchair? What is the gender of a child in the back of your car? What is the gender of your dog? These are the kinds of questions that I've been asked by people all across the countryWhat is the gender of a babysitter? I don't knowWhat is the gender of a babysitter? The gender of a babysitter can be determined by a parent's reaction and the reactions of the childrenWhat is the gender of a babysitter? ""It's a girl"" 
What is the gender of a babysitter? The gender of a babysitter does not change when a babysitter is a boy or a girlWhat is the gender of a babysitter? A: A maleWhat is the gender of a babysitter? What is the gender of a babysitter? A male, a female, or something in between? I've heard a number of answers to this questionWhat is the gender of a babysitter? A babysitter is a babysitter is a babysitter is a babysitterWhat is the gender of a babysitter? The gender of a babysitter is not known for sureWhat is the gender of a babysitter? A male, or a female? A male babysitter A female babysitter Which of the following is not a valid reason to hire a babysitter? AWhat is the gender of a babysitter? A: I don't have a babysitterWhat is the gender of a babysitter? A: The gender of a babysitter is usually maleWhat is the gender of a babysitter? What is the gender of your child? Gender is the social construct we use to describe how people relate to each otherWhat is the gender of a babysitter? The gender of a babysitter is determined by the babysitter, and is not based on their genderWhat is the gender of a babysitter? The answer is ""it dependsWhat is the gender of a babysitter? The gender of a babysitter depends on the gender of your child, but the gender is not the same as the gender of your childWhat is the gender of a babysitter? The gender of the babysitter is not always obviousWhat is the gender of a babysitter? The gender of a babysitter is usually a womanWhat is the gender of a babysitter? ""A man babysits for a womanWhat is the gender of a babysitter? I was thinking about a babysitterWhat is the gender of a babysitter? A: The gender of a babysitter is usually femaleWhat is the gender of a babysitter? The answer depends on the state of your stateWhat is the gender of a babysitter? The answer is a very simple one: it's a girlWhat is the gender of a babysitter? I don't have oneWhat is the gender of a babysitter? AWhat is the gender of a babysitter? The gender of a babysitter is usually a girl, as it would be for a motherWhat is the gender of a babysitter? The question of gender is a complicated one, and the answers depend on who you askWhat is the gender of a babysitter? A: MaleWhat is the gender of a babysitter? The answer is, ""it depends on what you think of babysittingWhat is the gender of a babysitter? What's a girl's favorite food? How many hours does it take to make a sandwich? What is the difference between the word ""candy"" and the word ""cocoa""? What does the letter ""C"" stand for? What is the difference between the words ""candy"" and ""caramel""? What does the word ""cocoa"" mean? How do
",0,0,50
